titulo,img,descripcion,puntuacion,precio,marca,ASIN,categoria
"DEKO Caja Herramientas Completa con Destornillador Electrico/Taladro con bateria de 8V, Maletin de 126 Piezas, Caja profesional de herramientas Domésticas de Bricolaje para Oficinas y Jardín, Amarillo","https://images.mejoresresenas.es/image/fetch/c_scale,f_auto/https%3A%2F%2Fm.media-amazon.com%2Fimages%2FI%2F51KueEeho7L._SL500_.jpg","PUEDES OBTENER HERRAMIENTAS- taladro profesional ; Juego de Brocas, Set de Puntas de Presicion, Destornilladores, Martillo, Llaves Allen, Mango para puntas intercambiables, Cinta Metrica, y mucho mas., MALETÍN HERRAMIENTAS IMPRESCINDIBLE PARA CASA- EL caja de herramientas eléctricas domésticas profesionales bricolaje contiene las herramientas de diseño para mantenimiento o mantenimiento más prácticas y avanzadas. Es muy adecuado para la decoración, el montaje de muebles, la perforación, el corte, la jardinería, la Oficina o el mantenimiento diario del hogar. Las herramientas se almacenan cuidadosamente en cajas sólidas para mantenerse seguras, limpias, ordenadas y fáciles de encontrar., DE ALTA CALIDAD, ROBUSTOS Y DURADEROS-DEKO caja herramientas manufacturadas en acero cromado CR-V de alta calidad para evitar corrosión y oxidación. Recubiertas por mangos de goma resistentes para mejor control., CON BATERÍA RECARGABLE 1.5AH, CABLE C-DEKO taladro eléctrico está equipado con un cable de carga C - 1.5AH. Puede conectarlo a un cargador universal o a una salida USB (5vd.c) para cargar la herramienta. el indicador de batería se encuentra en la parte posterior de la herramienta y la batería está llena cuando el indicador de batería Verde está estable y no parpadea., 8V TALADRO PROFESIONAL CON LED- El destornillador electrico se puede utilizar para perforar en madera y plástico, o para apretar / aflojar tornillos. Presione el interruptor para ajustar la velocidad del taladro eléctrico, con una velocidad máxima sin carga de 800r / MIN para el atornillador electrico. El destornilladores electricos con luces LED incorporadas, el peso neto del taladro manual es de solo 0.75KG, lo que facilita la operación con una sola Mano.","9,8","69,99 €",DEKO,1,15
JBM Maletín portaherramientas de 108 piezas con llaves hexagonales satinadas,"https://images.mejoresresenas.es/image/fetch/c_scale,f_auto/https%3A%2F%2Fm.media-amazon.com%2Fimages%2FI%2F51-gJai1YHL._SL500_.jpg","Tipo de producto: WRENCH, JBM Maletín portaherramientas de 108 piezas con llaves hexagonales satinadas, Color: Negro","9,5","54,45 €",JBM,2,15
"STANLEY Caja de Herramientas Essential, Dimensiones: 40,6 x 20,5 x 19,5 cm, Cierres Metálicos, Asa Ergonómica, Organizadores en Tapa, Bandeja Extraíble - STST1-75518","https://images.mejoresresenas.es/image/fetch/c_scale,f_auto/https%3A%2F%2Fm.media-amazon.com%2Fimages%2FI%2F31m7KLjrbNL._SL500_.jpg","SEGURIDAD ADICIONAL: Cuenta con un orificio para candado, proporcionando una protección para tus herramientas, ORGANIZACIÓN EFICIENTE: Organizadores integrados en la tapa y bandeja interior extraíble para mantener tus herramientas ordenadas, GAMA VARIADA: Disponible en 4 medidas para adaptarse a tus necesidades, CIERRES METÁLICOS: Brindan un cierre seguro y duradero., ASA ERGONÓMICA: Facilita el transporte y manejo de la caja de herramientas","9,4","13,34 €",STANLEY,3,15
Mannesmann M29166 - Maletín con juego de llaves de vaso y puntas de destornillador (130 piezas),"https://images.mejoresresenas.es/image/fetch/c_scale,f_auto/https%3A%2F%2Fm.media-amazon.com%2Fimages%2FI%2F51BhhlVjotL._SL500_.jpg","Maletín de plástico duro con llaves de vaso y puntas, Incluidas en un maletín de plástico, Extensión de 50 mm, Asiento de la herramienta: 1/4 "" (6.3 mm), 13 x llaves tubulares de cubo 6,3 mm (1/4"""") de 4 - 14 mm","9,3","23,45 €",MANNESMANN,4,15
"Amazon Basics Juego de herramientas para el hogar, Plástico, Negro/ Gris, 32 Unidad","https://images.mejoresresenas.es/image/fetch/c_scale,f_auto/https%3A%2F%2Fm.media-amazon.com%2Fimages%2FI%2F51DXP2kUBHL._SL500_.jpg","Mango ergonómico de plástico antideslizante, Conveniente estuche de almacenamiento moldeado por soplado, Contiene todo lo que necesitas para pequeños trabajos de bricolaje y reparación, Aleación de acero de alta calidad, Advertencia: Lleva gafas de seguridad para protegerte y no golpees acero endurecido u otros martillos mientras usas el martillo de mano","9,1","24,19 €",AMAZON BASICS,5,15
"STANLEY Bonus Pack 2 Cajas de herramientas de plástico 12.5""/32cm + 19""/48cm , Cierres de metal, Asa ergonómica, Organizadores integrados en las tapas, STST1-75772","https://images.mejoresresenas.es/image/fetch/c_scale,f_auto/https%3A%2F%2Fm.media-amazon.com%2Fimages%2FI%2F412RvhIgyBL._SL500_.jpg","STANLEY Bonus Pack 2 Cajas de herramientas de plástico 12.5""/32cm + 19""/48cm , Cierres de metal, Asa ergonómica, Organizadores integrados en las tapas, STST1-75772",9,"24,90 €",STANLEY,6,15
"Perel Caja de herramientas, polipropileno, con bandeja de herramientas extraíble, manija plegable y cierres de plástico, negro/amarillo, 410 x 209 x 195 mm","https://images.mejoresresenas.es/image/fetch/c_scale,f_auto/https%3A%2F%2Fm.media-amazon.com%2Fimages%2FI%2F31mP3S23geL._SL500_.jpg","ORGANIZACIÓN: la caja de herramientas le permite almacenar y almacenar sus herramientas correctamente, sin riesgo de pérdida o daño., MANGO ERGONÓMICO: la caja de herramientas tiene un mango ergonómico que le permite transportarlo fácilmente a su próximo proyecto., LIGERO: la caja está hecha de polipropileno, un material que es robusto y ligero. Esto lo hace muy robusto y le permite resistir los choques., CARCASA ROBUSTA: la robusta caja de plástico protege sus herramientas de daño y los 2 cierres de plástico sólido aseguran la caja durante el transporte., BANDEJA DE HERRAMIENTAS EXTRAÍBLE: la bandeja del soporte de herramientas garantiza un almacenamiento perfecto de sus tornillos, pernos, tuercas y otras habitaciones pequeñas.","8,9","10,57 €",PEREL,7,15
"Amazon Basics Caja de herramientas de uso general para el hogar, 173 piezas","https://images.mejoresresenas.es/image/fetch/c_scale,f_auto/https%3A%2F%2Fm.media-amazon.com%2Fimages%2FI%2F51hufmcoBlL._SL500_.jpg","Tenga en cuenta que el juego de herramientas incluye ciertos artículos con solo medidas métricas SAE o imperiales, Sus mangos de plástico antideslizantes proporcionan una mayor comodidad y control, El estuche moldeado por soplado permite almacenar y transportar las herramientas con seguridad y comodidad, Dimensiones: 42.9 x 32.2 x 8.5 cm, De aleación de acero cromada y tratada térmicamente para una resistencia duradera y resistente a la corrosión, Caja de herramientas de 173 piezas para reparaciones básicas del hogar y proyectos cotidianos; incluye 8 llaves combinadas, una llave de carraca de 3/8 pulgadas, 22 llaves hexagonales, un alicate ajustable de 6 pulgadas, un alicate de punta larga de 6 pulgadas y más, Advertencia: lleva gafas de seguridad para garantizar su seguridad mientras usas el martillo de mano","8,6","49,99 €",AMAZON BASICS,8,15
"STANLEY Taller Móvil Essential para Herramientas 3 en 1, Caja de herramientas 45cm, Asa Plegable, Organizadores en Tapa, Cierres Metálicos, Ruedas 18cm, STST1-80151","https://images.mejoresresenas.es/image/fetch/c_scale,f_auto/https%3A%2F%2Fm.media-amazon.com%2Fimages%2FI%2F413apfpiBtL._SL500_.jpg","RUEDAS DE 18CM: Facilitan el desplazamiento del taller móvil en diferentes superficies, ORGANIZADORES:compatimentos en la tapa para pequeñas piezas que permite mantener ordenadas y accesibles los componentes más pequeños, CIERRES METÁLICOS CON BLOQUEO: Proporcionan seguridad adicional al asegurar el contenido de la caja de herramientas, ASA PLEGABLE: Facilita el transporte cómodo y almacenamiento del taller móvil de herramientas, 3 EN 1: Caja de herramientas, módulo central y compartimentos de gran capacidad; espacio para almacenar una variedad de herramientas y accesorios","8,5","40,20 €",STANLEY,9,15
"DEKO Caja Herramientas Completa 100 Piezas, Maletin caja de Herramientas Bricolaje para el Hogar, Oficia y Coche, con Juego de Destornilladores, Martillo, y Set de Alicates para Mantenimiento Diario","https://images.mejoresresenas.es/image/fetch/c_scale,f_auto/https%3A%2F%2Fm.media-amazon.com%2Fimages%2FI%2F51-0EZOy%2BvL._SL500_.jpg","VARIEDADES COMPLETAS: Contiene las herramientas necesarias para la mayoría de las reparaciones pequeñas y los proyectos básicos de bricolaje en la casa., FÁCIL DE LLEVAR Y ALMACENAR: Se encuentra en un práctico estuche moldeado por soplado para un fácil almacenamiento y portabilidad de la herramienta, DISEÑO FUNCIONAL STREAMLINED: una combinación de una variedad de herramientas básicas, destornilladores de precisión, martillos, cinta métrica, alicates, etc. También tiene una mini llave de trinquete de doble función y una funda para llave. Herramientas limitadas con funcionalidad ilimitada, DISEÑO DE GRAN ORGINALIDAD: El estuche negro lo hace resistente a la suciedad. Tamaño de la caja: 13.39 ""* 9.84"" * 3.54 "". Peso neto 7.54 lb, ALTA CALIDAD Y NORMAS: forjadas en acero de alta calidad y acabadas en cromo de alto brillo, resistencia, durabilidad, protección anticorrosiva","8,4","39,09 €",DEKO,10,15
"RUVALINO Mochila porta pañales Mochila grande para pañales con bolsa multifuncional para el bebé y cambiador móvil - Portachupetes - para mamá y papá (Negro), Talla única","https://images.mejoresresenas.es/image/fetch/c_scale,f_auto/https%3A%2F%2Fm.media-amazon.com%2Fimages%2FI%2F41BqL7G7d7L._SL500_.jpg","Lo que obtendrá - 1 mochila para pañales de tamaño normal con cambiador (dimensión: 30l x 19,8w x 41,9h cm, Peso: 0,81kg; Tamaño del tapete: 58,4l x 38,1w cm). Dos grandes compartimentos con cierre de cremallera y 16 bolsillos, lo suficientemente amplios como para guardar la mayoría de los objetos esenciales del bebé y seguir teniendo un aspecto perfectamente organizado y compacto. Los bolsillos aislados para biberones pueden contener la de cuello ancho o alto, desde 0,14 kg hasta 0,31 kg., Durable que durará años - Nuestra mochila para pañales está hecha de un tejido ligero, duradero e impermeable (más fuerte que la bolsa para bebés de poliéster de sarga, mejor en resistencia a la deformación y al desgarro). Costuras que no se deshacen y cremalleras resistentes. Costuras reforzadas en las correas de los hombros y el asa, sin desgarros., Diseñada para la comodidad - La apertura extra ancha hace que esta mochila para pañales sea fácil de encontrar lo esencial en caso de apuro, y las cremalleras dobles facilitan el acceso y el cierre incluso con una sola mano. El asa de fácil agarre y el diseño ergonómico de la espalda y las gruesas correas acolchadas para los hombros le ofrecen un transporte cómodo y de refuerzo., Convertible y tan versátil - Esta bolsa de pañales puede utilizarse como mochila, bolso de mano, también puede colgarse en el cochecito. Elegante y adecuado para muchas ocasiones como ir de compras, viajar, etc. Además, el diseño práctico y unisex hacen que esta mochila portapañales sea perfecta para viajar con sus hijos y sus hijas, ¡un regalo ideal para un baby shower!, Construción práctica y actualizada - El interior de nuestra bolsa de pañales incluye un bolsillo acolchado para el portátil, bolsillos de malla organizadores y otros elementos de organización. Mantenga la temperatura de sus biberones en los bolsillos aislados, no pierda nunca las llaves ni la cartera en el bolsillo para mamás y coja rápidamente un pañal del organizador de malla para pañales.","9,8","40,98 €",RUVALINO,11,8
"Disney 04061 Mochila Mommy Roar, Unisex adulto, Turquesa, Talla única","https://images.mejoresresenas.es/image/fetch/c_scale,f_auto/https%3A%2F%2Fm.media-amazon.com%2Fimages%2FI%2F51Tn3rV6yYL._SL500_.jpg","Mochila de maternidad para enseres de bebé, Dimensiones: 20 x 40 x 25 cm, Cuerpo exterior repelente a líquidos con apertura para fácil acceso, Bolsillo lateral con cremallera dispensadora de toallitas o pañuelos, Bolsillo frontal con compartimentos para biberones con forro térmico","9,7","40,23 €",DISNEY,12,8
"Dikaslon Mochila Cambiador, Mochila Pañalera Grande Bolsas Multifuncionales para Bebés con Cambiador Portátil, Portachupete y Correas para el Cochecito, para Mamá y Papá (Gris Oscuro)","https://images.mejoresresenas.es/image/fetch/c_scale,f_auto/https%3A%2F%2Fm.media-amazon.com%2Fimages%2FI%2F51qeBIeaziL._SL500_.jpg","Portachupetes y Cambiador Portátil: La vaina del chupete extraíble puede contener dos chupetes y estar disponibles y limpios. El anillo en forma de D permite colgar rápida y fácilmente el estuche del chupete u otros elementos esenciales como el desinfectante de manos, bolsas para cambio, pequeños accesorios, etc. Cuenta con cambiador de viaje con bolsillo para pañales y para toallitas húmedas, así como bolsillos para mamás con correa para la muñeca para cambios rápidos y sobre la marcha., No es Sólo Bolso Maternal: Diseño elegante y unisex que hace del bolso para bebés una buena elección para mujeres y hombres. Los papás están felices de usarlo en público mientras realizan sus tareas de papás. El bolso pañalero también puede ser usado como mochila, bolso de mano, cartera y más. Incluso será una gran pieza de equipaje de mano luego de que pase la infancia. ¡Ideal para viajar con sus niños y niñas! ¡También es un regalo ideal para la lista de nacimiento de un Baby Shower!!, Durabilidad que perdura: Nuestra mochila maternal para el cambio de pañales está confeccionada con una tela de poliéster ligera e impermeable. Incluye un forro resistente a los derrames y fácil de limpiar. No tienes que temer a la leche o agua derramada. Las costuras no se deshilachan, el asa superior es fácil de llevar, el diseño ergonómico de la espalda y las gruesas correas acolchadas para los hombros liberan la tensión y proporcionan comodidad al trasladarlo., Diseño Integral: Una mochila pañalera de gran capacidad (tamaño: 42 x 20 x 30 cm) con cambiador portátil, correas para el cochecito, portachupete, bolsillo con cremallera para toallitas, un llavero y 5 bolsillos isotérmicos. Múltiples bolsillos (2 grandes compartimentos y 18 bolsillos) en todos los lugares adecuados. Es sencillo para empacar, tomar y trasladar. El bolsillo del cambiador en el interior también puede contener tabletas y computadoras portátiles de hasta 15 pulgadas., Cómodo y Manos Libres: La apertura extra amplia te permite obtener rápidamente lo que necesites y las suaves cremalleras dobles del SBS permiten un fácil acceso, ¡y cierre incluso con una sola mano! El bolsillo trasero antirrobo puede guardar con seguridad tus objetos de valor. Las correas de la silla de paseo incorporadas cuelgan fácilmente tu mochila pañalera en cualquier cosa.","9,6","34,83 €",DIKASLON,13,8
RAINSMORE Mochila Bebe Multifuncional Mochila Carro Bebe Pañaleras para Bebes con Cambiador Portátil y Correas para el Cochecito Grande Mochila Maternidad Albaricoque,"https://images.mejoresresenas.es/image/fetch/c_scale,f_auto/https%3A%2F%2Fm.media-amazon.com%2Fimages%2FI%2F41qkNb2b-2L._SL500_.jpg","MÚLTIPLES COMPARTIMENTOS GRAN CAPACIDAD: Esta mochila bebe mide 31 x 21 x 44 cm, viene con un cambiador portátil y una bolsa de lavandería de pañales impermeable, la mochila tiene un total de 20 compartimentos y bolsillos, hay mucho espacio para la mayoría de los elementos esenciales de su bebé, que mantendrá cada artículo organizado y es perfecto para los padres de bebés., MULTIFUNCIÓN:Este juego de 3 piezas de pañaleras para bebes viene con una correa para cochecito que puedes colgar en tu cochecito. También hay una correa de equipaje en la parte trasera que se puede enganchar fácilmente al asa de cualquier maleta, liberando tus manos. No sólo es una bolsa de pañales, sino también una mochila, una bolsa de mano, una bolsa de viaje, perfecta para el día a día, para ir de compras, para viajar y para muchas otras ocasiones., DISEÑO DURADERO:Nuestras mochila carro bebe están fabricadas con tejido ligero, duradero e impermeable con forro a prueba de salpicaduras y fácil de limpiar. Además, la mochila está diseñada con un asa superior fácil de llevar, un diseño ergonómico de la espalda, correas acolchadas para los hombros mejoradas, correas duraderas para el cochecito, un compartimento para el portátil de 15,6"" y un bolsillo trasero antirrobo para que te sientas cómodo y seguro mientras la llevas., CAMBIADOR PLEGABLE Y BOLSA PARA LAVAR PAÑALES:El cambiador portátil y la bolsa de lavandería para pañales están diseñados con una correa para cochecito que puedes colgar en tu cochecito para cambiar rápidamente los pañales en cualquier momento y lugar. El cambiador está hecho de esponja acolchada y contiene un bolsillo para pañales y otro para toallitas. La bolsa impermeable para pañales puede contener ropa sucia, toallitas húmedas o pañales, etc., BOLSILLOS AISLADOS PARA BIBERONES:Nuestras mochila maternidad cuentan con un compartimento isotérmico mejorado que incluye dos bolsillos isotérmicos para biberones y dos bolsillos para cucharas y tenedores para mantener los biberones calientes. Los bolsillos isotérmicos para biberones cuentan con costuras reforzadas y correas elásticas que se adaptan a la mayoría de marcas de biberones y son muy resistentes y duraderos.","9,5","33,59 €",RAINSMORE,14,8
"Bolso para Carrito de Bebé Mochila de Pañales con Cuna Extensible QUINO&CO. Unisex con Ganchos Carro, Funda para Biberones, Chupetero, USB | Regalo Bebes Recien Nacidos (Gris)","https://images.mejoresresenas.es/image/fetch/c_scale,f_auto/https%3A%2F%2Fm.media-amazon.com%2Fimages%2FI%2F41QT0nC85FL._SL500_.jpg","【 MULTIFUNCIONAL 】: la mochila pañalera de QUINO&CO con cambiador te ofrece la posibilidad de llevar todo lo que necesites para tus más pequeños en tu momento de maternidad. Puedes usarla como mochila, como bolso para cochecito de bebé o para llevarla en la mano. Guarda todos los esenciales para cualquier viaje y conviértela en cuna-cambiador abriendo la cremallera posterior., 【 GRAN IDEA PARA REGALO 】: es una oportunidad de poder sacar una sonrisa a amigos, papás y mamás. Sirve como excelente regalo para baby shower o detalles para recién nacidos., 【 GRAN CAPACIDAD Y USB 】: con hasta 15 bolsillos útiles para tener organizado todo lo que necesita tu bebé, La mochila tiene bolsillos en la parte delantera, en sus laterales y en la parte superior. El compartimento principal tiene una apertura más grande que el resto de mochilas similares. Además, dispone de conexión USB para cargar tus dispositivos (powerbank no incluida) y un colgador de llaves interno., 【 DISEÑO ÚNICO 】: la bolsa está diseñada de forma precisa y con mucho cariño, incluyendo un chupetero de cuero y una funda con aislante térmico para biberones y botellas. El interior está hecho de detalles de cuero y puntadas reforzadas en los puntos donde necesita mayor resistencia., 【 CAMBIADOR PLEGABLE PREMIUM 】: la exclusiva mochila pañalera de QUINO&CO incluye un cambiador desmontable y colchón lavable para mantenerla limpia e higiénica. Hemos mejorado el montaje y la funcionalidad para facilitar su uso.","9,4","24,99 €",QUINO & CO.,15,8
"Ohotter Mochilas de Pañales para Bebé, Grande Mochila Carro Bebé, Impermeable Multifuncionales Bolsas para Bebés con Portátil Cambiador y Porta Chupones Para Mamá y Papá (Gris Oscuro)","https://images.mejoresresenas.es/image/fetch/c_scale,f_auto/https%3A%2F%2Fm.media-amazon.com%2Fimages%2FI%2F51CL7PXq--L._SL500_.jpg","Puerto USB: con un puerto de carga USB extendido en el lateral de la mochila y un cable de carga integrado en el interior, ofrece un fácil acceso a carga tu teléfono cuando llevan una mochila en la carretera (el banco de energía no está incluido), Cómodo y duradero: La espalda ergonómica y las correas acolchadas gruesas hacen que sea cómodo de llevar durante mucho tiempo. Las correas de hombro son fácilmente ajustables y también se adaptan a marcos más anchos, lo que es una buena opción para mamá y papá. El uso inteligente de la malla hace que sea transpirable y mejora la fricción, no se desliza fácilmente de tus hombros. La bolsa está hecha de tela Oxford 900D duradera e impermeable, Conveniente y organizado: Cada madre sabe cuántas cosas necesitas cuando sales con el bebé. Esta bolsa de pañales de gran capacidad con diseño de múltiples bolsillos te mantendrá a ti y a tu bebé organizados y fáciles de encontrar, Conveniente y organizado: Cada madre sabe cuántas cosas necesitas cuando sales con el bebé. Esta bolsa de pañales de gran capacidad con diseño de múltiples bolsillos te mantendrá a ti y a tu bebé organizados y fáciles de encontrar, Contenido del paquete: 1 mochila de pañales (42 x 35 x 25 cm), 1 cambiador (72 x 32 cm), 2 ganchos de hebilla para cochecito, 2 varillas de apoyo plegables y 1 línea de datos. No es solo una mochila, sino también un bolso, una bolsa de cochecito, adecuada para actividades diarias al aire libre, compras, picnics, viajes, etc. El diseño neutro y de moda es muy adecuado para mamá y papá para usar cuando sales, Bolsa de bebé todo en uno: Este diseño de bolso cambiador cuenta con una cuna plegable y viene con un cambiador de pañales intercambiable para adaptarse a diferentes necesidades al sacar al bebé. Cuando tu bebé necesita dormir, la bolsa de pañales se convierte en una cuna segura y suave, proporcionando un ambiente limpio y cómodo para dormir. Al usar instalaciones públicas de cambio, que no siempre son las más limpias","9,3","30,99 €",OHOTTER,16,8
"Vicloon Bolso Mochilas de Pañales y Biberones para Bebé, Gran Capacidad Mochila de Cambio para Mamá y Papá (Blanco)","https://images.mejoresresenas.es/image/fetch/c_scale,f_auto/https%3A%2F%2Fm.media-amazon.com%2Fimages%2FI%2F41duCkM5gsL._SL500_.jpg","【Gran Capacidad & 10 Bolsillos】--Bebe mochilas para pañales mamá bolso de maternidad impermeable con 10 bolsillos! Puede organizar todo lo que su bebé necesita con rapidez, eficiencia y funcionalidad, tienda botella de agua, ropa mojada o seca del bebé, botella de leche, pañal del bebé, toalla etc., 【2 Maneras Para Llevar】--Multifuncional viajes bolsa de versátil pañal las correas ajustables y desmontable lo permite a ser llevado como un bolso de mensajero de cuerpo cruzado, bolso de los hombros y totalizador. Colgarlo detrás de un cochecito de bebé o llevado en el equipaje. una apariencia de moda con compartimento perfecto, es usado para el negocio, también las compras, fiestas de amigos. también es guay para la mamá y el papá., 【Protector de Botellas Isotérmico】-- El color de la cremallera y el color del forro son negro o beige, color aleatorio. Esta pañal bolso mochila del bebé tiene 3 aislado bolsillo separado para la botella, para guardar los biberones de leche y para mantener el líquido caliente o frío. Que usted y su bebé puedan disfrutar de un servicio de calidad seguro., 【Material Impermeable y Cómodo】--Multifuncional impermeable bolsa de pañales del mamá de viajes para bebés con bolsillo impermeable te ayuda a separar la toalla mojada de la ropa seca, no necesita preocuparse por salpicar líquido en la bolsa de pañales. Para que tu mochila de viaje esté limpia y ordenada. Con un cambiador, puede cambiar fácilmente el pañal de su bebé durante su viaje., 【Material De Alta Calidad】--Mochila pañalera para viajes, robusto de alta calidad de 300d de tela oxford con una fuerza más alta y una resistencia de deformación. Con un mayor degaste y resistencia de deformación, resistente al agua, derrames y manchas, fácil de limpiar.","9,2","22,99 €",VICLOON,17,8
