titulo,img,descripcion,puntuacion,precio,marca,ASIN,categoria
"Gigabyte NVIDIA GeForce RTX 4060 WINDFORCE OC Targeta gráfica - 8GB GDDR6, 128-bit, PCI-E 4.0, 2475MHz Core Clock, 2x DP 1.4, 2x HDMI 2.1a, NVIDIA DLSS 3 - GV-N4060WF2OC-8GD","https://images.mejoresresenas.es/image/fetch/c_scale,f_auto/https%3A%2F%2Fm.media-amazon.com%2Fimages%2FI%2F51t%2BYiti-YL._SL500_.jpg","Pieza de recambio, Modelo y marca: GIGABYTE RTX 4060 WF2OC, Componente informático","9,1","327,95 €",GIGABYTE TECHNOLOGY,131,1
"ASUS Dual GeForce RTX 3050 OC Edition 6GB GDDR6 (Resistencia al Polvo IP5X, Soporte de Acero Inoxidable, PCIe 4.0, DLSS 3, HDMI 2.1, DisplayPort 1.4a, DVI-D)","https://images.mejoresresenas.es/image/fetch/c_scale,f_auto/https%3A%2F%2Fm.media-amazon.com%2Fimages%2FI%2F41xktjuWkHL._SL500_.jpg","Núcleos tensoriales de tercera generación: obtenga hasta el doble de rendimiento con escasez estructural y algoritmos de IA avanzados como DLSS. Estos núcleos ofrecen un enorme impulso en el rendimiento del juego y capacidades de IA completamente nuevas., Núcleos RT de 2.ª generación: experimente el doble de rendimiento que los núcleos RT de 1.ª generación, además de RT y sombreado simultáneos para un nivel completamente nuevo de rendimiento de trazado de rayos., Multiprocesadores de transmisión NVIDIA Ampere: el nuevo Ampere SM ofrece el doble de rendimiento del FP32 y una eficiencia energética mejorada., La resistencia al polvo IP5X ofrece protección contra la entrada de partículas para una mayor durabilidad., Edición OC: Boost Clock 1537 MHz (modo OC)/ 1507 MHz (modo predeterminado)",9,"221,64 €",ASUS,132,1
"ASUS Phoenix NVIDIA GeForce RTX 3050 V2 - Tarjeta Gráfica Gaming (PCIe 4.0, 8GB GDDR6, HDMI 2.1, DisplayPort 1.4a, Ventiladores Axial-tech, Placa de Protección, Auto-Extreme)","https://images.mejoresresenas.es/image/fetch/c_scale,f_auto/https%3A%2F%2Fm.media-amazon.com%2Fimages%2FI%2F41MmWJxwBtL._SL500_.jpg","Núcleos Tensor de 3.a gen.: Disfruta del doble de rendimiento con escasez estructural y algoritmos de IA óptimos como DLSS. Estos núcleos aumentan notablemente el rendimiento gaming y ofrecen nuevas capacidades de IA, Multiprocesadores de Streaming NVIDIA Ampere: El SM Ampere ofrece el doble de rendimiento y consume menos energía que FP32, Multiprocesadores de Streaming NVIDIA Ampere: El SM Ampere ofrece el doble de rendimiento y consume menos energía que FP32, Los ventiladores Axial-tech presentan unas aspas más largas y un anillo de bloqueo que incrementa la presión de aire hacia abajo Ventiladores con doble rodamiento de bolas que duran el doble, La tecnología Auto-Extreme aumenta la fiabilidad automatizando la fabricación","8,9","217,97 €",ASUS,133,1
"Gigabyte NVIDIA GeForce RTX 4060 GAMING OC Targeta gráfica - 8GB GDDR6, 128-bit, PCI-E 4.0, 2550MHz Core Clock, 2x DP 1.4, 2x HDMI 2.1a, NVIDIA DLSS 3 - GV-N4060GAMING OC-8GD","https://images.mejoresresenas.es/image/fetch/c_scale,f_auto/https%3A%2F%2Fm.media-amazon.com%2Fimages%2FI%2F516s5LgtKpL._SL500_.jpg","Pieza de recambio, Modelo y marca: GIGABYTE RTX 4060 Gaming OC, Componente informático","8,8","364,90 €",GIGABYTE TECHNOLOGY,134,1
"Tongfushop Rotulador de 100 Colores, Rotulador Doble Punta 2S Secado Rápido, Rotuladores Alcohol Permanent con Bolsa de Almacenamiento y Espaciador para Bocetos, Cómics, Colorear, Ilustrar, Esbozar","https://images.mejoresresenas.es/image/fetch/c_scale,f_auto/https%3A%2F%2Fm.media-amazon.com%2Fimages%2FI%2F51egE2ZvaPL._SL500_.jpg","️【Calidad Profesional y Seguridad】Desde principiantes hasta artistas experimentados, nuestros marcadores ofrecen resultados de calidad profesional que inspiran creatividad. Están hechos con materiales no tóxicos y ecológicos, seguros para artistas de todas las edades, brindándote tranquilidad mientras creas., ️【Doble Punta para Mayor Versatilidad】Disfruta de la flexibilidad de las puntas dobles: una punta fina para detalles precisos y una cincelada ancha para trazos audaces y sombreado. Ya sea que estés dibujando, coloreando o diseñando, nuestros marcadores se adaptan a tus necesidades creativas., 【Identificación Fácil, Organización y Portabilidad】No pierdas tiempo buscando el color perfecto. Nuestros marcadores tienen tapas codificadas por color para una organización eficiente. Además, el estuche de transporte incluido hace que estos marcadores sean perfectos para cualquier aventura artística o como un regalo pensado para cualquier artista., 【Mezcla Perfecta & Coloración Suave】Disfruta de una coloración sin rayas ni interrupciones con nuestros marcadores. La tinta de alta calidad fluye suavemente, asegurando una aplicación uniforme en cada uso para que tus obras luzcan profesionales y pulidas., 【100 Colores Impresionantes】Sumérgete en un mundo de color con nuestros marcadores a base de alcohol. El arcoíris está al alcance de tu mano – elige entre 100 colores brillantes que ofrecen tonos intensamente pigmentados y ricos, dando vida a tus creaciones con una vibrancia incomparable., 【Tinta Resistente al Desvanecimiento y de Secado Rápido】Crea obras de arte que soportan el paso del tiempo. Nuestros marcadores están hechos con tinta resistente al agua y al desvanecimiento, manteniendo tus obras frescas y vibrantes. La fórmula de secado rápido minimiza las manchas y permite un mayor ritmo de capas.","9,8","38,89 €",TONGFUSHOP,135,13
"Tongfushop Rotulador de 80 Colores, Rotuladores Alcohol Impermeabile, Seguro y Secado Rápido Rotuladores Doble Punta con Base y Maletín de Transporte, Adecuado para Bocetos, Cómics","https://images.mejoresresenas.es/image/fetch/c_scale,f_auto/https%3A%2F%2Fm.media-amazon.com%2Fimages%2FI%2F516L4c87UmL._SL500_.jpg","【No Tóxico y Respetuoso con el Medio Ambiente】Damos gran importancia al impacto de los productos en la salud. Siempre ponemos la salud en primer lugar. Los marcadores de alcohol Tongfushop han pasado la certificación estándar internacional MSDS, EN71 y ASTM-D4236. Los materiales son no tóxicos y libres de ácido, seguros y respetuosos con el medio ambiente. Permite que tu familia los usen., 【Fácil Mezclado, Sin Limpiar】Olvídate de los colores irregulares y irregulares. La tinta de alta calidad se mezcla sin problemas para crear hermosos efectos de color incluso para principiantes. ¡nunca más dejes que la tinta húmeda arruine tu trabajo! Dibuja sin manchas gracias a la fórmula de secado rápido a base de alcohol. Además, tu obra de arte nunca se desvanecerá ni se difuminará con el tiempo., 【Fácil Identificación, Organización y Portabilidad】no pierdas el tiempo buscando el color correcto. Las tapas codificadas por colores evitan que las puntas se sequen y te ayudan a encontrar marcas en un abrir y cerrar de ojos., 【Fino y cincelado, Doble Punta, Doble Diversión】¡Amplía tus horizontes artísticos con el diseño de marcador de doble punta! Crea detalles precisos con la punta fina de 1 mm, mientras agregas textura, una variedad de marcas y coloreas rápidamente grandes áreas con la punta de cincel ancha de 1-6 mm. ¡Deja que tu creatividad tome las riendas de tu mente y cuerpo!, 【80 Colores Vibrantes】El arcoíris está al alcance de tus manos: elige entre 80 colores brillantes y da vida a tus ideas. Desde libros para colorear hasta obras maestras profesionales, nuestros marcadores de alcohol darán vida a tu obra de arte. Son una herramienta de trabajo imprescindible en muchos campos del diseño, la ilustración y las bellas artes.","9,7","27,89 €",TONGFUSHOP,136,13
Alpino 12 Rotuladores de Colores | Punta Resistente de 3mm para Colorear | Tinta Súper Lavable y de Larga Duración | Estuche de Rotuladores de Colores Brillantes | Material Escolar,"https://images.mejoresresenas.es/image/fetch/c_scale,f_auto/https%3A%2F%2Fm.media-amazon.com%2Fimages%2FI%2F31TxqKb0NNL._SL500_.jpg","Tinta súper lavable - La tinta hecha a base de agua ofrece una calidad inmejorable y permite su fácil lavado en la mayoría de tejidos, por ello podrás utilizar sus colores brillantes en cualquier soporte y material creativo como cuaderno, diario, mandalas, lettering… Siendo también perfectos para el uso escolar o la vuelta al cole., Ideales para uso escolar - Los rotuladores de punta de 3mm son de colores brillantes y perfectos para el uso escolar, destacan por la seguridad de su tinta hecha a base de agua. Además, cuenta con una punta super resistente y un capuchón super ventilado., El rotulador de los más pequeños - El set de 12 rotuladores de Alpino, está pensado para los más pequeños de la casa. Su punta de 3mm los hace perfectos para iniciarse en el mundo del dibujo y la pintura. Ofreciendo una gama de colores vivos y brillantes con tinta súper lavable para que puedan disfrutar sin límites., Disfruta coloreando - Los rotuladores de punta de 3mm pueden ser utilizados tanto por niños como por adultos, de manera que podréis compartir momentos junto a los más pequeños coloreando cualquier dibujo o realizando manualidades., Alpino abarca una amplia gama de rotuladores de colores brillantes de larga duración y con punta resistente, están indicados tanto para el uso escolar como para adultos y artistas.","9,6","1,46 €",ALPINO,137,13
"CRESZZLE Set de Rotuladores Duales: rotuladores doble punta 48, rotuladores profesionales, caja – Para uso en diseño, renderizado, cómics, proyectos de bricolaje, bolsa negra incluida.","https://images.mejoresresenas.es/image/fetch/c_scale,f_auto/https%3A%2F%2Fm.media-amazon.com%2Fimages%2FI%2F3148F6sVnBL._SL500_.jpg","Tinta de alta calidad: Disfruta de una saturación de colores rica y una gracias a nuestra tinta permanente de alta calidad. Los rotuladores acrilicos, no tóxicos y sin ácido, ofrecen una combinación perfecta de colores en cada uso., Punta fina y punta biselada: Disfruta de un control preciso de las líneas y una mezcla de colores superior con rotuladores profesionales. Permite crear fácilmente líneas gruesas y finas., Innovadores y versátiles: Nuestros rotuladores punta pincel son los más innovadores y versátiles. Ideales para decorar ropa y proyectos de bricolaje como posavasos, tazas, etc., Diseño fácil de usar: Nuestros rotuladores lettering tienen un diseño ergonómico que los hace fáciles de sostener y usar. Las tapas son de colores y llevan el nombre de los colores, facilitando la elección de la tonalidad deseada., 48 colores permanentes: Descubre la calidad artística profesional con nuestros rotuladores colores. Ideales para dibujar, crear, renderizar, manga, libros de colorear para adultos y mucho más.","9,5","13,99 €",CRESZZLE,138,13
Rotulador alpino double double punta gruesa y punta fina caja de 20+4 colores surtidos,"https://images.mejoresresenas.es/image/fetch/c_scale,f_auto/https%3A%2F%2Fm.media-amazon.com%2Fimages%2FI%2F51Nset-h7xL._SL500_.jpg","Tinta súper lavable - La tinta hecha a base de agua ofrece una calidad inmejorable y permite su fácil lavado en la mayoría de tejidos, por ello podrás utilizar sus colores brillantes en cualquier soporte y material creativo como cuaderno, diario, mandalas, lettering… Siendo también perfectos para el uso escolar o la vuelta al cole., Rotuladores doble punta - El set de 24 rotuladores de colores de doble punta de Alpino, cuenta con punta fina de 2,3mm y punta gruesa de 3,6mm en el mismo rotulador para que puedas rellenar grandes superficies con la punta gruesa y perfilar detalles con la punta fina., Ideales para uso escolar - Son perfectos para trabajos escolares como pintar dibujos o mandalas, ya que la punta gruesa te permitirá colorear grandes superficies y la punta fina perfilar detalles., Disfruta en familia - Los rotuladores de doble punta pueden ser utilizados tanto por niños como por adultos, de manera que podréis compartir momentos junto a los más pequeños coloreando cualquier dibujo o realizando manualidades ¡Disfruta en familia!, Alpino abarca una amplia gama de rotuladores de colores brillantes de larga duración y con punta resistente, están indicados tanto para el uso escolar como para adultos y artistas.","9,4","5,33 €",ALPINO,139,13
"BIC Intensity, Rotuladores de Punta Fina (0,9 mm), Colores Surtidos de larga duración, Paquete de 24 uds.","https://images.mejoresresenas.es/image/fetch/c_scale,f_auto/https%3A%2F%2Fm.media-amazon.com%2Fimages%2FI%2F51c2wrCJrUL._SL500_.jpg","Una amplia paleta de 24 colores vivos, perfecta para dejar volar tu imaginación, Su tinta a base de agua no se seca, aunque se deje destapada durante un mes (excepto la negra)., Regalos originales ideales para subrayar con precisión, escribir o crear un llamativo código de colores., Estos rotuladores colores vienen en un elegante estuche negro y están especialmente diseñados para adolescentes y jóvenes, El cuerpo de estos rotuladores para mandalas es del mismo color que la tinta, por lo que podrás distinguirlos a primera vista.","9,3","5,43 €",BIC,140,13
"Peakness Rotuladores Lettering Profesionales de 40 Colores, Pincel Doble Punta con Libro de Dibujo, Rotuladores Acuarelables para Graffiti, Caligrafía, Dibujo, Lettering para Niños y Adultos","https://images.mejoresresenas.es/image/fetch/c_scale,f_auto/https%3A%2F%2Fm.media-amazon.com%2Fimages%2FI%2F51vkAwnKfUL._SL500_.jpg","【Uso Amplio】Los lettering rotuladores con punta pincel pueden ser ampliamente utilizado, adecuados para caligrafía, pintura, graffiti, dibujos animados o cómics, rotulación a mano, tarjetas de felicitación, diarios de balas y proyectos escolares. Sirven no solo para los niños, sino también para adultos., 【Tinta de Calidad】Hechos de materiales de alta calidad y tinta a base de agua sin ácido ni tóxico, los rotuladores son inodoros, seguros tanto para niños como para adultos. La tinta del marcador fluye suavemente y se seca rápidamente al escribir, y la coloración es fácil y uniforme., 【Rotuladores Lettering de Doble Punta】Los rotuladores tiene doble punta: pincel y punta superfina. La pincel de fibra de nailon de 1-4 mm se utiliza para colorear. La punta de 0,4 mm en el otro extremo se utiliza para dibujar contornos y complementar detalles., 【Material Duradero】Hay 5 reemplazos de punta con instrucciones de reemplo en el paquete. Además, los marcadores de punta fina tienen una caja de papel exquisita y dos compartimentos de plástico. Cada bolígrafo tiene su propia ubicación para garantizar que todos los elementos estén organizados y sean fáciles de transportar., 【40 Colores para Lettering】Este juego cotiene 40 colores graduales. Cada rotulador tiene el color único correspondiendo al color del capuchón, por lo que es conveniente elegir el color deseado. El cabezal de cepillo de nailon tiene buena elasticidad y transpirabilidad, puede controlar con facilidad y precisión para producir pinceladas delicadas.","9,2","13,99 €",PEAKNESS,141,13
"Lyuvie 60 Colores Rotuladores Lettering Rotuladores Punta Pincel Doble Punta para Adultos y Artistas,Rotuladores Punta Fina Lettering Kit para Niñas, Principiantes, Caligrafía, Dibujar","https://images.mejoresresenas.es/image/fetch/c_scale,f_auto/https%3A%2F%2Fm.media-amazon.com%2Fimages%2FI%2F51RXk7Ca%2BwL._SL500_.jpg","❀Rotuladores Lettering : Rotuladores Punta Pincel consta de una punta de pincel suave de 1-2 mm y una punta fina de 0,4 mm, para sombrear colorear para delinear le permite escribir en líneas finas y gruesas.Rotuladores doble punta para escribir a mano y libros para colorear, diseño de arte y colorear en áreas grandes.Brush pens se puede utilizar para dibujar y escribir.Rotuladores punta fina pueden estimular su imaginación y creatividad y permitirle no tener límites al crear arte, ❀Regalo Exquisito: Lettering kit para niñas muchos colores vienen en una bolsa de lona fina que no necesita ser envuelta como regalo.Si eres un amigo que ama el arte, este sería el regalo perfecto y considerado.Rotuladores acuarelables regalo ideal para mamá, mujer, Hombres, adultos, profesores, estudiantes universitarios, principiantes y para usar en la escuela., ❀Portátil & Flexible: Rotuladores mandalas adultos están cuidadosamente colocados en la bolsa, son fáciles de transportar, ya sea que vaya a clase, una excursión de primavera o un boceto de campo puede estar en su bolsa, no hay confusión y cada pincel tiene un código de color, usted puede encontrar fácilmente el color que desee.Con rotuladores doble punta, su creación artística nunca se detendrá., ❀Material Premium & Seguro: Rotuladores lettering punta pincel no contienen ácido, no son tóxicos, los colores se pueden dispersar , mezclar con agua, no es necesario preocuparse por las manchas,las manchas y son inodoros.Brush pen darán líneas consistentes para detalles de bellas artes y letras de pincel.Rotuladores punta fina perfecto para libros para colorear, bocetos, ilustraciones, dibujo, planificador,cuaderno, calendario y más., ❀60 Magníficos Colores Lettering Kit:Rotuladores mandalas adultos obtendrá 60 colores diferentes brillantes, vibrantes y altamente pigmentados.Rotuladores de lettering se utilizan tinta de alta calidad con colorante de punta natural, que es fácil de separar y mezclar al crear arte.Con tantos colores abundantes, usted Puede combinar los colores con su imaginación para crear una obra de arte única.","9,1","23,99 €",LYUVIE,142,13
"Set de Rotuladores Duales: rotuladores doble punta 80, rotuladores profesionales, caja rotuladores – Para uso en diseño, renderizado, cómics, proyectos de bricolaje, bolsa negra incluida.","https://images.mejoresresenas.es/image/fetch/c_scale,f_auto/https%3A%2F%2Fm.media-amazon.com%2Fimages%2FI%2F41CzxIlACNL._SL500_.jpg","Secado rápido y fácil de llevar: La tinta de secado rápido da vida y saturación a sus dibujos. Nuestros rotuladores lettering son fáciles de llevar y no dejan manchas en la ropa, la piel ni las manos., Secado rápido y fácil de llevar: La tinta de secado rápido da vida y saturación a sus dibujos. Nuestros rotuladores lettering son fáciles de llevar y no dejan manchas en la ropa, la piel ni las manos., Protección contra fugas con tinta mejorada: Hemos mejorado varias veces la tinta de nuestros rotuladores profesionales para reducir las fugas. Con un relleno de tinta adecuado, puedes prolongar la vida útil de tus marcadores., Innovadores y versátiles: Nuestros rotuladores acuarelables son de los más innovadores y versátiles. Perfectos para decorar ropa, bolsos, zapatos y proyectos de bricolaje como posavasos, bolas de Navidad, tazas y más., Diseño único de doble punta: Nuestros rotuladores doble punta cuentan con un diseño especial de doble punta, una punta delgada (aproximadamente 1 mm) para dibujos precisos y una punta ancha (aproximadamente 6 mm) para rellenar colores.","8,9","18,29 €",CRESZZLE,143,13
"Juego de Rotulador 40 Colores Rotuladores Lettering Profesionales Doble Punta Pincel para Niños con Fino (0,4mm) y Grueso (1-2mm) Brush Pen Para Caligrafía Dibujo Coloreado Mandalas Marcadores","https://images.mejoresresenas.es/image/fetch/c_scale,f_auto/https%3A%2F%2Fm.media-amazon.com%2Fimages%2FI%2F51dpDNPsmyL._SL500_.jpg","Tinta de calidad: tinta soluble en agua, líquida e inodora, duradera y de secado rápido, con colores brillantes y vivos. sin tener que preocuparse por las manchas., Idea de regalo perfecta: nuestro juego de rotuladores de doble pincel de colores es ideal para tus rotulaciones diarias, dibujos, manualidades, garabatos de Halloween, ilustraciones y obras de arte. Juego de rotuladores creativos para regalo de cumpleaños, día de la madre, Navidad, regreso a la escuela, Acción de Gracias., DOBLE CONSEJOS: el juego de rotuladores de doble fieltro de punta de pincel de 1 – 2 mm te permite aplicar fácilmente líneas gruesas, finas o variadas en un solo golpe. La punta fina de 0,4 mm es ideal para contornos, detalles y dibujos., COLORES ÚNICOS: 40 colores brillantes y soporte para bolígrafo codificado por colores, que es más fácil elegir el color correcto cada vez, inspirar su creatividad., Alta calidad: todos los pinceles de doble fibra y el fineliner funcionan sin problemas al saltarse o fluir la tinta. En particular, las puntas del cepillo hechas de fibras de nylon se pueden capas fácilmente y mezclar diferentes colores.","8,8","11,99 €",LDUMODUW,144,13
BIZTEE MAGICALS-JUGUETE MASCOTA INTERACTIVA DIGITAL-JUEGO INTERACTIVO CON 20 ANIMALES MÁGICOS EN SU INTERIOR - Mascotas Virtuales y Electrónicas que Reaccionan al Tacto-6069066-Juguetes Niños 5 Años +,"https://images.mejoresresenas.es/image/fetch/c_scale,f_auto/https%3A%2F%2Fm.media-amazon.com%2Fimages%2FI%2F41Xs0tQXE3L._SL500_.jpg","REGALOS PARA NIÑOS: ¡Regalos niños 5 años La mascota virtual Biztee Magicals es un gran regalo para niños y niñas a partir de 5 años y es ideal para cualquier ocasión (cumpleaños, Navidad, Reyes...).¡Disfruta de tu mascota interactiva y colecciona los 15 animales, MASCOTA INTERACTIVA DIGITAL QUE PUEDES TOCAR: Bitzee Magicals se sale de la pantalla 2D, ¡es una mascota virtual que puedes acariciar y sentir en nuestra realidad 3D Cada mascota mágica interactiva Bitzee reacciona si la inclinas, la tocas o si deslizas el dedo por la barra, JUGUETES NIÑOS 5 AÑOS +: Gana pociones mientras juegas con los juegos infantiles de Super-Bitzee y cambia los colores de tu personaje. Desliza el dedo por las gemas del cofre del tesoro, lanza hechizos con la varita mágica y transforma a tu Bitzee. ¡Disfruta de las mascotas interactivas coleccionables como nunca antes lo habías hecho, INCLUYE: 1 Bitzee Magicals, 1 guía de inicio rápido, 1 guía de instrucciones, 3 Pilas AA, CUIDA DE TU MASCOTA INTERACTIVA Y JUEGA CON ELLA: Las mascotas interactivas mágicas Bitzee Fantasy necesitan tu cariño y tus cuidados. Cada mascota virtual Bitzee comienza como un bebe y crece con tus cuidados. Alimenta tu mascota digital y juega con ella, mécela para que se duerma y quiérela mucho para que pase de bebé a adulto y, finalmente, ¡a Super-Bitzee, 20 MASCOTAS INTERACTIVAS DE JUGUETE EN 1 SOLA CÁPSULA: Cuanto más juegues, más mascotas mágicas Bitzee desbloquearás. Rompe las gemas para atraer a los personajes mágicos y colecciona los 20 animales interactivos como Phoenix, unicornios, dragones ¡y mucho más","9,8","37,99 €",BITZEE,145,6
HERSITY Maletín Veterinaria Perritos de Juguetes Cuidado de Mascotas Juego de rol Regalos para Niños Niñas 3 4 5 Años,"https://images.mejoresresenas.es/image/fetch/c_scale,f_auto/https%3A%2F%2Fm.media-amazon.com%2Fimages%2FI%2F51o6z6YJUwL._SL500_.jpg","[Maletín Veterinario Juguete] - Puede utilizar como una mochila o maletín. El maletín puede recoger y almacenar todos los accesorios de juguete. Deje que los niños lo lleven fácilmente para jugar en interiores y exteriores., [Juguetes para Niños Niñas de 3 4 5 Años] - Es muy bueno especialmente para los niños que aman a los animales. Adecuado para regalos de cumpleaños, regalos de Navidad, recompensas, jardín de infantes, juego de rol, juegos de fiesta, juegos imitacion., [Juego de Rol para Niños] - Este juguete veterinario es bueno para que los niños sepan cómo cuidar a las mascotas y aprender a responsabilizarse de ellas. Ayude a los niños a desarrollar imaginación y habilidades motoras finas., [16 Piezas Cuidado de Mascotas Juguete ] - Con perrito, tijeras, secador de pelo, caja de alimentos, gel de ducha, peine, etc. Los niños se enamorarán de este lindo y suave cachorro de peluche y le darán cuidado y belleza., Tamaño del paquete: 20×9×24 cm. Materiales: Plástico. Durable, no tóxico, seguro para su bebé.","9,5","19,99 €",HERSITY,146,6
"Clementoni - Mémo Disney Classic Pocket - Juego Educativo Que Incluye 48 Fichas para Emparejar De Tus Personajes Favoritos, Juguete para Niños De 4-6 Años, Made In Italy, 18308","https://images.mejoresresenas.es/image/fetch/c_scale,f_auto/https%3A%2F%2Fm.media-amazon.com%2Fimages%2FI%2F51X8iSplVEL._SL500_.jpg","¡El juego de memoria se vuelve aún más divertido con Disney!, Un juego que estimula la memoria y la capacidad de asociación de los niños., Un juego clásico que cautiva a grandes y pequeños., Made in Italy., Con 48 fichas para memorizar y emparejar para recrear parejas con las mismas imágenes.","9,2","4,99 €",CLEMENTONI,147,6
