titulo,img,descripcion,puntuacion,precio,marca,ASIN,categoria
"Nuevo Amazon Kindle (16 GB), el Kindle más ligero y compacto, con pantalla sin reflejos, pasos de página más fluidos, luz frontal ajustable y batería de larga duración | Sin publicidad, negro","https://images.mejoresresenas.es/image/fetch/c_scale,f_auto/https%3A%2F%2Fm.media-amazon.com%2Fimages%2FI%2F41XttfzNxbL._SL500_.jpg","Tu biblioteca, siempre contigo: gracias a sus 16 GB de almacenamiento, tendrás espacio para miles de libros, revistas y cómics., Refúgiate en la lectura: no dejes que te distraigan mensajes, e-mails o notificaciones de redes sociales y disfruta de una experiencia de lectura sin distracciones., Lee tanto como quieras: disfruta de una batería con autonomía de hasta 6 semanas en una única carga., Lee cómodamente bajo cualquier luz: lee con total comodidad gracias a su pantalla sin reflejos de 6"" con modo oscuro y luz frontal ajustable, ahora un 25 % más potente en el nivel de máxima intensidad., El Kindle más ligero y compacto: ahora con una luz frontal más potente en el nivel de máxima intensidad, mayor contraste y pasos de página más fluidos, para que disfrutes aún más de la lectura., Diseñado con la sostenibilidad en mente: este Kindle está fabricado con un 75 % de plásticos reciclados y un 90 % de magnesio reciclado. El 99 % del embalaje del dispositivo está hecho a base de fibra de madera y procede de bosques gestionados responsablemente o materiales reciclados., Descubre nuevas historias: con la suscripción a Kindle Unlimited, puedes contar con acceso ilimitado a millones de libros, miles de audiolibros y suscripciones a revistas seleccionadas.","9,6","119,00 €",AMAZON,89,1
"Kobo Clara B&W Libro Electrónico Multimedia 6"" 16GB Negro","https://images.mejoresresenas.es/image/fetch/c_scale,f_auto/https%3A%2F%2Fm.media-amazon.com%2Fimages%2FI%2F41oP378-%2BuL._SL500_.jpg","Totalmente resistente al agua* (*Cumple los requisitos de la clasificación IPX8. Resistente al agua hasta una profundidad de 2 metros durante 60 minutos como máximo.), Pantalla táctil antirreflejos E Ink Carta 1300 de alta definición y 6”, Lleva contigo hasta 12 000 eBooks o 75 audiolibros Kobo con 16 GB de almacenamiento y semanas de duración de la batería, Exterior fabricado con plástico reciclado y plástico recuperado de los océanos, Escucha audiolibros Kobo con tecnología inalámbrica Bluetooth** (Los audiolibros solo están disponibles en una selección de países. Se necesitan altavoces o auriculares inalámbricos Bluetooth.), Ajusta el brillo y la temperatura del color con ComfortLight PRO","9,4","149,00 €",KOBO,90,1
"Variación Scribas Woxter (Black, 6"")","https://images.mejoresresenas.es/image/fetch/c_scale,f_auto/https%3A%2F%2Fm.media-amazon.com%2Fimages%2FI%2F21zVIn9KWEL._SL500_.jpg",Variación Scriba,"9,3","72,00 €",WOXTER,91,1
"Kobo Nía Lector electrónico, Pantalla táctil sin Reflejos de 6"", Brillo Ajustable, WiFi, 8 GB de Almacenamiento, tecnología Carta E Ink, Negro (Renovado)","https://images.mejoresresenas.es/image/fetch/c_scale,f_auto/https%3A%2F%2Fm.media-amazon.com%2Fimages%2FI%2F51UD4oqHLZS._SL500_.jpg","Kobo Nía Lector electrónico, pantalla táctil sin reflejos de 6"", brillo ajustable, delgada y liviana, WiFi, 8 GB de almacenamiento, tecnología Carta E Ink, negro (Renovado).","9,1","99,99 €",KOBO,92,1
Todo muere (Todo arde 3),"https://images.mejoresresenas.es/image/fetch/c_scale,f_auto/https%3A%2F%2Fm.media-amazon.com%2Fimages%2FI%2F41EYBsHDznL._SL500_.jpg",Sin descripcion,"8,9","6,17 €",EDICIONES B,93,3
"SPC Dickens Light 2 - Libro electrónico con Pantalla retroiluminada y luz con 6 Niveles de Intensidad, Teclas Frontales, posición Vertical y Horizontal, 1 Mes de autonomía, Ligero y Fino, Color Negro","https://images.mejoresresenas.es/image/fetch/c_scale,f_auto/https%3A%2F%2Fm.media-amazon.com%2Fimages%2FI%2F41CWgosjMcL._SL500_.jpg","Un mes de autonomía - Con una batería de litio-polímero, este ebook tiene una autonomía que puede llegar hasta un mes de vida, pudiendo variar en función del modo de uso e intensidad de la luz, Posición vertical y horizontal - Disfruta de tu pasión por la lectura con tu ebook en cualquier momento del día, gracias a su luz en pantalla, y en cualquier posición, ya que su pantalla gira para que puedas leer en vertical u horizontal, Pantalla retroiluminada - Pantalla de 6” de tinta electrónica retroiluminada con 6 niveles de intensidad. Calidad de lectura como en papel, desde cualquier ángulo, sin brillo ni luz en pantalla. Lectura antirreflejos, no cansa la vista. Hasta 6 tamaños de letra diferentes, Muy fino y ligero - Tu lectura favorita en la palma de la mano. Este eReader cuenta con un diseño tan fino (8mm) y ligero (168g) que podrás manejarlo perfectamente con una sola mano mientras lees, Funciones prácticas - Para disfrutar al máximo de ese momento de lectura, el libro electrónico SPC DICKENS LIGHT 2 te lo pone muy fácil con diversas funciones sencillas e intuitivas como Diccionario, “Ir a página”, búsqueda de palabras, cambio de página manual o automático, o marcadores de página, entre otros, Almacenamiento sin límite - Sucumbe a tu gusto por la lectura y almacena hasta 20.000 libros en sus 8GB de memoria, ampliable con micro SD de hasta 8GB. Conecta tu SPC DICKENS LIGHT 2 a un equipo mediante cable Micro USB y carga tus libros para empezar a disfrutar.","8,8","90,00 €",SPC,94,1
El niño que perdió la guerra (Éxitos),"https://images.mejoresresenas.es/image/fetch/c_scale,f_auto/https%3A%2F%2Fm.media-amazon.com%2Fimages%2FI%2F51s%2BspPv7OL._SL500_.jpg",Sin descripcion,"9,9","23,65 €",PLAZA & JANES,95,3
La isla de la Mujer Dormida (Hispánica),"https://images.mejoresresenas.es/image/fetch/c_scale,f_auto/https%3A%2F%2Fm.media-amazon.com%2Fimages%2FI%2F419ccu8%2B%2B%2BL._SL500_.jpg",Sin descripcion,"9,8","21,75 €",ALFAGUARA,96,3
La asistenta: El adictivo thriller viral que está arrasando internacionalmente: 1 (SUMA),"https://images.mejoresresenas.es/image/fetch/c_scale,f_auto/https%3A%2F%2Fm.media-amazon.com%2Fimages%2FI%2F412kRKwq90L._SL500_.jpg",Sin descripcion,"9,7","18,90 €",SUMA DE LETRAS.,97,3
El monje que vendió su Ferrari: Una fábula espiritual (Clave),"https://images.mejoresresenas.es/image/fetch/c_scale,f_auto/https%3A%2F%2Fm.media-amazon.com%2Fimages%2FI%2F51VDe7cx%2BZL._SL500_.jpg",Sin descripcion,"9,6","9,95 €",DEBOLSILLO,98,3
El arte de la guerra (SIN COLECCION),"https://images.mejoresresenas.es/image/fetch/c_scale,f_auto/https%3A%2F%2Fm.media-amazon.com%2Fimages%2FI%2F41BXSq3o%2BRL._SL500_.jpg",Sin descripcion,"9,5","8,07 €",DOJO EDICIONES,99,3
Redes (Invisible 2) (Nube de Tinta),"https://images.mejoresresenas.es/image/fetch/c_scale,f_auto/https%3A%2F%2Fm.media-amazon.com%2Fimages%2FI%2F41QsahZCCBL._SL500_.jpg",Sin descripcion,"9,4","15,15 €",NUBE DE TINTA,100,3
"Cómo hacer que te pasen cosas buenas: Entiende tu cerebro, gestiona tus emociones, mejora tu vida (Crecimiento personal)","https://images.mejoresresenas.es/image/fetch/c_scale,f_auto/https%3A%2F%2Fm.media-amazon.com%2Fimages%2FI%2F4199eWYDocL._SL500_.jpg",Sin descripcion,"9,3","19,85 €",ESPASA,101,3
"Hábitos atómicos: Cambios pequeños, resultados extraordinarios (Autoconocimiento)","https://images.mejoresresenas.es/image/fetch/c_scale,f_auto/https%3A%2F%2Fm.media-amazon.com%2Fimages%2FI%2F41cjU43UUQL._SL500_.jpg",Sin descripcion,"9,2","18,90 €",DIANA EDITORIAL,102,3
"Deja de ser tú (Crecimiento personal), la portada puede variar","https://images.mejoresresenas.es/image/fetch/c_scale,f_auto/https%3A%2F%2Fm.media-amazon.com%2Fimages%2FI%2F41HXoZkyhgL._SL500_.jpg","Urano, Tapa blanda, SPANISH, La portada puede variar, Deja de ser tú (Crecimiento personal)","9,1","17,10 €",URANO,103,3
La Biblioteca de la Medianoche (AdN) (AdN Alianza de Novelas),"https://images.mejoresresenas.es/image/fetch/c_scale,f_auto/https%3A%2F%2Fm.media-amazon.com%2Fimages%2FI%2F51ZRexM7uJL._SL500_.jpg",Sin descripcion,9,"4,74 €",ALIANZA EDITORIAL,104,3
"Moulinex Easy Fry Max 5L – Freidora aire para cocinar en poco tiempo, ahorro energético hasta 70%, panel control intuitivo, 10 programas automáticos,para 6 personas, recetario digital, EZ2458","https://images.mejoresresenas.es/image/fetch/c_scale,f_auto/https%3A%2F%2Fm.media-amazon.com%2Fimages%2FI%2F313bX5j10ML._SL500_.jpg","[RECETARIO DIGITAL]: Escanea el código QR en tu smartphone o tableta y descubre el recetario Easy Fry con recetas deliciosas y atractivas que querrás hacer todas, [MENOS TIEMPO DE COCINADO] Freidora de aire de 1500 W de potencia con tecnología avanzada que ahorra tiempo en la cocina, cocinando con aire caliente comidas sanas en nada de tiempo, con poco o ningún aceite añadido, [GRAN CAPACIDAD DE 5 L]: Prepara comida para toda la familia con su amplia capacidad de 5 L que permite cocinar para hasta 6 personas; pensada para esas ocasiones especiales cuando recibes invitados y quieres sorprenderlos, [FÁCIL DE UTILIZAR]: Panel de control digital intuitivo que permite utilizar la freidora de forma sencilla y configurarla rápido; Toque frío para un uso cómodo y seguro, [APTA LAVAVAJILLAS]: Su cesta de freír antiadherente PTFE y rejilla son aptas para el lavavajillas para poder limpiar y mantener su cesta sin esfuerzo, [AHORRO ENERGÉTICO 70%]: Ahorra hasta un 70 % de energía y un 46 % de tiempo según una prueba externa realizada con 800 g de patatas fritas congeladas, en comparación con un horno de convección de Tefal, [10 PROGRAMAS AUTOMÁTICOS]: Obtén resultados deliciosos con sus 10 preajustes: patatas fritas, pollo, filete, pescado, postre, pizza, nuggets, verduras, gambas y bacon","9,9","101,62 €",MOULINEX,105,"1,2"
"COSORI Freidora de Aire Duradera 5.5 L Air Fryer 1700W, Tecnología Rapid Air, 55% Menos Energía, 13 Automáticos Modos, Uso Sencillo, Panel Táctil Intuitivo, Acero Inox Interior, Hasta 205 °C y 60 Min","https://images.mejoresresenas.es/image/fetch/c_scale,f_auto/https%3A%2F%2Fm.media-amazon.com%2Fimages%2FI%2F51JCiy3b6mL._SL500_.jpg","[ 𝟓𝟓% 𝐌á𝐬 𝐑á𝐩𝐢𝐝𝐨 ] 1700W de potencia lo hacen 3 veces más rápido que los hornos convencionales, con comidas listas en minutos., [ 𝟓.𝟓𝐋 𝐆𝐫𝐚𝐧 𝐂𝐚𝐩𝐚𝐜𝐢𝐝𝐚𝐝 ] Puedes cocinar para 6 personas a la vez, fácil preparación de comidas para reuniones familiares., [ 𝟑 𝐀ñ𝐨𝐬 𝐝𝐞 𝐆𝐚𝐫𝐚𝐧𝐭í𝐚 ] ¡Cualquier problema en cualquier momento para ponerte en contacto con el servicio al cliente de COSORI, sirviendo para tu satisfacción!, [ 𝐓𝐞𝐜𝐧𝐨𝐥𝐨𝐠í𝐚 𝐂𝐢𝐫𝐜𝐮𝐥𝐚𝐜𝐢ó𝐧 𝐝𝐞 𝐂𝐚𝐥𝐨𝐫 𝟑𝟔𝟎° ] Los alimentos se calientan más uniformemente y saben mejor., [ 𝐑𝐞𝐜𝐞𝐭𝐚𝐫𝐢𝐨 𝐄𝐬𝐩𝐚ñ𝐨𝐥 ] 100 recetas en papel y 300+ recetas online gratis, ¡los cocineros novatos pueden hacer platos de nivel de chef profesional!, [ 𝐌𝐨𝐝𝐨 𝐝𝐞 𝐂𝐨𝐜𝐜𝐢ó𝐧 𝐅á𝐜𝐢𝐥 𝐜𝐨𝐧 𝟏 𝐏𝐮𝐥𝐬𝐚𝐜𝐢ó𝐧 ] 13 programas automáticos para facilitar la cocción; temperatura y tiempo ajustables（ Hasta 205ºC y 60 Min） para satisfacer todas las necesidades de cocción., [ 𝐅á𝐜𝐢𝐥 𝐝𝐞 𝐋𝐢𝐦𝐩𝐢𝐚𝐫 ] Cesta extraíble，compatible con lavavajillas, di adiós a la cocina sucia., [ 𝐂𝐨𝐦𝐞𝐫 𝐌á𝐬 𝐒𝐚𝐧𝐨 ] El interior está hecho de acero inoxidable para materiales más seguros. Cocinar sin aceite o 85% menos de aceite, la comida sigue siendo dorada y crujiente, llena y jugosa., [ 𝐂𝐨𝐜𝐢𝐧𝐚𝐫 𝐌á𝐬 𝐒𝐞𝐠𝐮𝐫𝐨 ] Protección contra sobrecalentamiento y base antideslizante.","9,8","99,99 €",COSORI,106,"1,2"
"Cecotec Freidora de Aire de 6L sin Aceite Cecofry Bombastik 6000, Air Fryer. 1700W, Aire Caliente, PerfectCook, Regulación de Temperatura y Tiempo, Control Táctil, 12 Modos, Temporizador, Negro","https://images.mejoresresenas.es/image/fetch/c_scale,f_auto/https%3A%2F%2Fm.media-amazon.com%2Fimages%2FI%2F312LpivT%2BKL._SL500_.jpg","Freidora dietética que permite cocinar con una sola cucharada de aceite, consiguiendo unos resultados más sanos., Diseño moderno y compacto con un panel de control táctil multifunción para controlar el funcionamiento., Cubeta de 6 L de capacidad para poder cocinar grandes cantidades de alimentos. 1700 W de potencia para cocinar de manera rápida todos los platos. Resultados excepcionales en todas las recetas gracias a la tecnología PerfectCook de aire caliente que circula por el interior y sale por los orificios traseros., Con protección contra sobrecalentamiento. Base antideslizante para favorecer su apoyo durante el funcionamiento., 12 modos preconfigurados que establecen el tiempo y la temperatura necesarios para cocinar distintos tipos de alimentos. Dispone de termostato para regular la temperatura desde 80 ºC hasta 200 ºC. Tiempo ajustable de 0 a 60 minutos.","9,5","49,90 €",CECOTEC,107,"1,2"
"Cecotec Freidora de Aire sin Aceite de 2,5L Air Fryer Cecofry Pixel 2500 Touch. 1200W, Táctil y Compacta, Temporizador, Control Temperatura, Tecnología PerfectCook, Pies Anti-deslizantes","https://images.mejoresresenas.es/image/fetch/c_scale,f_auto/https%3A%2F%2Fm.media-amazon.com%2Fimages%2FI%2F41-%2BLzrshPL._SL500_.jpg","Recipiente de 2.5 L de capacidad para poder cocinar para dos personas perfectamente. 1200 W de potencia para cocinar de manera rápida todos los platos. Resultados excepcionales en todas las recetas gracias a la tecnología PerfectCook de aire caliente que circula por el interior y sale por los orificios traseros., Freidora dietética que permite cocinar con una sola cucharada de aceite, consiguiendo unos resultados más sanos., Freidora de diseño elegante y compacto con una pantalla digital multifunción en la parte frontal para controlar el funcionamiento., Con protección contra sobrecalientamiento. Luz indicadora de funcionamiento. Base antideslizante para favorecer su apoyo durante el funcionamiento. Carcasa y asa de tacto frío., 6 modos preconfigurados que establecen el tiempo y la temperatura necesarios para cocinar distintos tipos de alimentos. Dispone de termostato para regular la temperatura desde 80ºC hasta 200 ºC. Tiempo ajustable de 0 a 60 minutos.","9,3","39,90 €",CECOTEC,108,"1,2"
"Cecotec Freidora de Aire sin Aceite Air Fryer de 7,6L Cecofry Absolute 7600. 2000W, Digital y Compacta, PerfectCook, Temperadura y Tiempo Regulable, Panel Táctil, 8 Modos","https://images.mejoresresenas.es/image/fetch/c_scale,f_auto/https%3A%2F%2Fm.media-amazon.com%2Fimages%2FI%2F31Trd8N116L._SL500_.jpg","Freidora dietética que permite cocinar con una sola cucharada de aceite, consiguiendo unos resultados más sanos., Diseño moderno y compacto con un panel de control táctil multifunción para controlar el funcionamiento., Cubeta de 7.6 L de capacidad para poder cocinar grandes cantidades de alimentos. 2000 W de potencia para cocinar de manera rápida todos los platos. Resultados excepcionales en todas las recetas gracias a la tecnología PerfectCook de aire caliente que circula por el interior y sale por los orificios traseros., Con protección contra sobrecalentamiento. Base antideslizante para favorecer su apoyo durante el funcionamiento., 8 modos preconfigurados que establecen el tiempo y la temperatura necesarios para cocinar distintos tipos de alimentos. Dispone de termostato para regular la temperatura desde 80 ºC hasta 200 ºC. Tiempo ajustable de 0 a 60 minutos.","9,1","64,90 €",CECOTEC,109,"1,2"
"Moulinex Easy Fry & Grill 4.2L EZ5058 Freidora de Aire Sin Aceite 2 en 1 para Freír o a la Parrilla, Pantalla Digital Táctil, 8 Programas para Comidas Sanas, App 125 recetas, Negro, hasta 6 personas","https://images.mejoresresenas.es/image/fetch/c_scale,f_auto/https%3A%2F%2Fm.media-amazon.com%2Fimages%2FI%2F415DAEGIAQL._SL500_.jpg","VARIEDAD DE RECETAS EN LA APP MOULINEX: Inspírate cada día gracias a la aplicación de Moulinex con más de 160 recetas deliciosas que puedes preparar con tu freidora de aire, TECNOLOGÍA GRILL: descubre su parrilla de aluminio fundido a presión y antiadherente para conseguir desde carnes tiernas y jugosas hasta verduras asadas con todo el sabor, FÁCIL DE USAR: sus 8 programas preestablecidos permiten una gran variedad de preparaciones de manera fácil, rápida y sana. Además, su pantalla digital intuitiva te brinda una mayor comodidad, con tiempo de cocción y temperatura ajustables, DISEÑO COMPACTO Y SEGURO: Freidora de aire compacta y moderna que se adapta a cualquier cocina. Su mango de tacto frío permite que sea más segura, incluso para niños y personas mayores, COCCIÓN RÁPIDA Y SIN ACEITE: con la air fryer Moulinex disfruta de unos resultados más crujientes con poco o sin aceite y un 49% más rápidos que un horno clásico. Platos más saludables y llenos de sabor en cuestión de minutos, CAPACIDAD 4,2L: Con una generosa capacidad de 4,2 litros, esta freidora de aire satisface las necesidades de toda la familia, ideal para hasta 6 personas; Las medidas de la cubeta son de 19,5 x 20,5 x 24,12 cm, AHORRO ENERGÉTICO: Ahorra hasta un 70% de energía* con nuestras freidoras sin aceite. Cocina más rápida, más económica y menor consumo de electricidad. *vs un horno tradicional de Clase Energética A. Pruebas realizadas en 2022 con patatas fritas congeladas",9,"79,99 €",MOULINEX,110,"1,2"
"Cecotec Freidora de Aire sin Aceite de 8L con Doble Resistencia, Plancha, Grill, Air Fryer Cecofry&Grill Duoheat 8000. 2200W, Dietética y Digital, Ventana, Temperatura Regulable 80-200°C, 8 Menús","https://images.mejoresresenas.es/image/fetch/c_scale,f_auto/https%3A%2F%2Fm.media-amazon.com%2Fimages%2FI%2F4107sRurSBL._SL500_.jpg","Marca tus carnes con la placa Grillin Style y consigue el punto óptimo en tus cortes de carne favoritos; prepara las pizzas auténticas en su plancha y consigue masas óptimas crujientes y doradas, La freidora permite controlar el progreso de tus elaboraciones sin necesidad de abrir la cubeta a través de su ventana de visualización; regula la temperatura entre 80-200°C, y ten un control total sobre tus preparaciones culinarias; ajusta la temperatura según tus necesidades específicas, desde cocciones lentas a alta temperatura hasta dorar y gratinar a lo óptimo, Freidora con 8 litros de capacidad; prepara deliciosas comidas para compartir con tu pareja o disfruta de platillos individuales con suficiente espacio para tus necesidades culinarias; su potencia de 2200 W permite cocinar recetas con una cucharada de aceite, reduciendo significativamente la cantidad de grasas en tus preparaciones; disfruta de platos saludables y deliciosos, sin sacrificar el sabor y la textura que tanto te gusta, Consigue resultados óptimos en menos tiempo; gracias a su diseño con doble resistencia arriba y abajo; distribuye el calor de manera uniforme, asegurando resultados consistentes y deliciosos en cada preparación, sin que tengas que girar tus alimentos de forma constante, Cocina todo con tu Cecofry gracias a su diseño que incorpora freidora de aire, grill para carne y plancha para prepara pizzas con masas óptimas","8,7","79,90 €",CECOTEC,111,"1,2"
"COSORI Freidora de Aire Duradera 4,7L, Máxima 230 °C, Air Fryer con 30+ Recetas en Español, 9 Programas, Diseño Moderno y Elegante, Silenciosa, Panel Táctil Sencillo, Gris, L501","https://images.mejoresresenas.es/image/fetch/c_scale,f_auto/https%3A%2F%2Fm.media-amazon.com%2Fimages%2FI%2F41XYtFh8eaL._SL500_.jpg","[VERSÁTIL y FÁCIL de USAR] Con 9 modos preconfigurados, es una gran alternativa a las freidoras y hornos tradicionales. Y con sólo pulsar un botón en el panel intuitivo, puedes causar sensación en la cocina con el L501 incluso no tienes ninguna experiencia en la cocina, [RÁPIDO y SABROSO] Buena ayuda para cocinas y ahorra un 50% del tiempo en comparación con la cocina tradicional. La temperatura máxima de 230°C garantiza que los alimentos queden dorados y crujientes rápidamente, [NUESTRO COMPROMISO] Contamos con un equipo de chefs profesionales y de expertos en nutrición, que investigan constantemente los procesos de cocción y diseñan las mejores recetas. Y completamos esta promesa con una GARANTÍA de 3 AÑOS y un EXCELENTE SERVICIO al CLIENTE, para que confíes siempre en tu producto COSORI, [MENOS ACEITE y MÁS SANO] Si estás a dieta, No tienes que sentirse culpable por la comida, COSORI-L501 puede ayudarte a reducir el consumo de grasas en un 85% para mejorar tu salud, [GRAN CAPACIDAD y DISEÑO MODERNO] Alta utilización del volumen, 4,7L de gran capacidad puede satisfacer fácilmente la necesidade de 2-3 personas. Diseño elegante y compacto muestra el ambiente moderno y ordenado de la cocina, [FÁCIL de LIMPIAR] Puedes limpiarla sólo con un paño, lo que hace la vida más confortable y libre de preocupaciones. Todos los accesorios extraíbles no contienen PFOA, tienen un revestimiento antiadherente que son aptos para el lavavajillas, [COCINA SILENCIOSA] La exclusiva tecnología COSORI AIR WHISPER reduce el ruido de funcionamiento a menos de 55dB, proporcionándole la experiencia culinaria más cómoda y silenciosa, [CALIDAD y MARCA] ¿Por Qué Elegir COSORI? COSORI es la marca No.1 de freidoras en España, elegida por 3 millones de familias en todo el mundo, con un estricto control de calidad para garantizar la mayor Durabilidad y Seguridad, para que puedas comer sano y tranquilo","8,4","89,99 €",COSORI,112,"1,2"
"EUDAI Freidora de Aire 6.5L, Freidora sin Aceite con Ventana, 8 programas, Pantalla LED, Control Táctil, Temperatura Regulable, Cesta Antiadherente, Temporizador, 1700W, Incluye Recetario, Acero Inox.","https://images.mejoresresenas.es/image/fetch/c_scale,f_auto/https%3A%2F%2Fm.media-amazon.com%2Fimages%2FI%2F416G14CrriL._SL500_.jpg","USO FÁCIL: 8 modos preconfigurados que establecen el tiempo y la temperatura necesarios para cocinar distintos tipos de alimentos. Tiempo ajustable de 0 a 60 minutos. Con protección contra sobrecalentamiento., RECETARIO EN TU IDIOMA: nuestra freidora viene con un libro de recetas (alemán / francés / italiano / ingles / español), PARA TODA LA FAMILIA: la freidora de 6,5L puede satisfacer la necesidad de una familia de 3 - 6 personas a la vez; la cesta cuadrada aprovecha al máximo el espacio disponible; puede usarla para hacer un pollo relleno entero en las fiestas. SEGURIDAD Y CONFIANZA: la función Protección de Apagado incorporada, el mango frío al tacto y el protector de botones hacen que sea más seguro para los ancianos y los niños operar en casa, COMIDA EN INSTANTES: la tecnología de circulación de 360° aire caliente hace que la air flyer se caliente rápidamente en tiempo corto, y la cesta hueca es conveniente para que el aire circule, lo que reduce el tiempo de espera para la comida. Dispone de termostato para regular la temperatura desde 80 ºC hasta 200 ºC., COCINA SIN ACEITE: con EUDAi Airfryer, puede disfrutar de la comida con un 80% menos de grasa que los alimentos fritos tradicionales; es la elección perfecta para llevar una vida sana y un buen cuerpo.","8,3","52,28 €",BOSTON TECH,113,"1,2"
"Instant Pot Vortex 4 en 1 Freidora de Aire Digital Antiadherente con Temporizador y Función de Horno y Calentador, 1.700 W – 5,7 L","https://images.mejoresresenas.es/image/fetch/c_scale,f_auto/https%3A%2F%2Fm.media-amazon.com%2Fimages%2FI%2F41JEV2RgqRL._SL500_.jpg","VERSATILIDAD COMPACTA: gracias a sus 4 programas completos, la freidora es perfecta para freir al aire, hornear pollos con patatas o incluso para preparar deliciosos bizcochos, SOMOS UNA FAMILIA: únete a Instant Pot en línea para hacer preguntas, ver consejos y obtener miles de respuestas y recetas de nuestros chefs caseros, SABOR SALUDABLE: la innovadora tecnología EvenCrisp te garantiza un crujiente superior con la tranquilidad de que has usado un 95% menos de aceite y de grasa, LIMPIA: no usar aceites ni grasas significa que evitarás manchas y superficies aceitosas. Tanto la canasta de la freidora como la bandeja son extraíbles y aptas para el lavavajillas, GRAN CAPACIDAD: la freidora sin aceite de 5,7 litros es ideal para preparar patatas asadas para la barbacoa con amigos, preparar guisos para toda la familia o para planificar la comida de toda la semana","8,2","42,05 €",INSTANT POT,114,"1,2"
