titulo,img,descripcion,puntuacion,precio,marca,ASIN,categoria
"STIGMA Kit de Tatuaje Completo Rotativa Pluma Maquina para Tatuar 10 Colores Tintas, Fuente de Alimentacion Digital 10pcs Cartuchos de Tatuaje y Instruccion STP35KITP192-5","https://images.mejoresresenas.es/image/fetch/c_scale,f_auto/https%3A%2F%2Fm.media-amazon.com%2Fimages%2FI%2F51gjMe8vGzL._SL500_.jpg","✱ PAQUETE INCLUIDO: El kit de máquina de pluma Stigma Tattoo incluye una maquina de tatuaje, una fuente de alimentación, un pedal, agujas de cartucho de tatuaje de 10 piezas, una cinta de tatuaje, 10 botellas de tintas de color de tatuaje, vasos de tinta de tatuaje de 30 piezas, 2 papel de transferencia, una piel de práctica y un par de guantes. Después de recibir nuestro kit, compruebe si faltan los accesorios anteriores., ✱ MOTOR SIN NÚCLEO DE ALTA VELOCIDAD: El pluma de tatuaje Stigma adopta un motor sin núcleo de alta velocidad y un concepto de diseño interno único. Resuelve una serie de problemas de los plumas de tatuaje tradicionales, como líneas de corte cansadas, fugas de color y líneas de corte falsas. La máquina se puede utilizar con las fuentes de alimentación inalámbricas universales actuales., ✱ KIT COMPLETO APTO PARA PRINCIPIANTES: Stigma kit de tatuaje profesional completo para principiantes y tatuadores. La fuente de alimentación de la pantalla digital le permite verificar y ajustar el voltaje en cualquier momento. Tanto si lo regalas a otros como a ti mismo, es una muy buena elección., ✱ BUENO PARA FORRO Y SOMBREADO: Pluma de tatuaje rotativo Stigma, el voltaje de trabajo es de 6-11V y el par máximo tolerable es de 189.3g.cm. La superficie está esmerilada, el golpe de la aguja es de 0-4.5 mm, la longitud de la aguja es de 3.5 mm y la interfaz RCA., ✱ 10pcs AGUJAS DE CARTUCHO DE TATUAJE ESTERILIZADO: El kit de máquina de tatuaje Stigma contiene 10 agujas de cartucho de tatuaje. (1003RLx5pcs, 1203RLx5pcs) Todas las agujas desechables han pasado la certificación CE y están preesterilizadas por E.O. Gas. La fecha indicada en cada paquete, proporciona una protección absoluta para tu arte del tatuaje.","9,3","49,99 €",STIGMA,34,"1,10"
"EZ Kit de Tatuaje - Kit de Máquina de Tatuar Completo con Rotulador para Máquina de Tatuar, Batería de 1500 mAh Fuente de Alimentación, 20Pzs Agujas de Tatuaje Surtido para Tatuadores (Caster S Rojo)","https://images.mejoresresenas.es/image/fetch/c_scale,f_auto/https%3A%2F%2Fm.media-amazon.com%2Fimages%2FI%2F51zrx3ta-jL._SL500_.jpg","【Máquina de tatuar con ruedas】La máquina de tatuaje Caster viene con un motor sin escobillas super torque hecho a medida que puede manejar fácilmente cualquier configuración de cartucho y tipo de trabajo. El diseño ligero y ergonómico mantiene la comodidad de la mano y reduce la fatiga de la mano que permite al artista trabajar perfectamente para el tatuaje larga sesión., 【Motor potente】Caster máquina de tatuaje utilizado con motor sin núcleo personalizado, 12V 10000RMP. Más potente, coloración rápida. Frecuencia del interruptor: 60 - 160 Hz; Voltaje de arranque: 5V; Voltaje de funcionamiento: 5-12V., 【Kit completo Value Package】El kit de tatuaje EZ incluye 1 x máquina de tatuaje Caster con fuente de alimentación de 1500mAh, 20 x cartuchos de agujas de tatuaje (5x1003RL/5x1005RL/5x1005RM/5x1007RM), 10 x tinta de tatuaje (7.5ml), 40 x vasos de tinta ECO-Friendly, 200 x fundas de máquina de tatuaje, 5 x venda de cuidado posterior del tatuaje, 1 x piel de práctica, 1 x venda de agarre del tatuaje, 1 x guantes de tatuaje., 【Fácil de usar】La máquina de tatuaje Caster viene con una fuente de alimentación de tatuaje inalámbrica. Capacidad de la batería: 1500mAh. Con el tiempo de carga de 2 horas, puede durar hasta 3-5 horas de tiempo de trabajo dependiendo del uso personal y la máquina de tatuaje., 【Agujas de Tatuaje Surtidas】El kit de rotulador de tatuaje viene con 20 tipos diferentes de agujas de cartucho de tatuaje (5x1003RL/5x1005RL/5x1005RM/5x1007RM), proporcionándole suficientes accesorios de tatuaje para hacer más y mejores trabajos de tatuaje. 3RL, 5RL para delinear, y 5RM, 7RM para sombrear.","9,2","69,00 €",EZ TATTOO,35,"1,10"
STIGMA Kit de Tatuaje Completo Máquina de Tatuaje Rotativa con 20 Cartuchos de Tatuaje Premium Juego de Tinta de 7 Colores Accesorios de Tatuaje EM123KITP162-1 Negra,"https://images.mejoresresenas.es/image/fetch/c_scale,f_auto/https%3A%2F%2Fm.media-amazon.com%2Fimages%2FI%2F51LDLcjRPML._SL500_.jpg","Todos nuestros artículos están garantizados por un año. Para cualquier consulta, no dude en contactarnos., Lipstick Tattoo Pen Kit es un kit profesional para cualquier tatuador o principiante en tatuajes, fácil de configurar y aprender a tatuar, más ligero que la máquina de bobinas, más fácil de controlar para aprender a tatuar más rápidamente., Kit completo de máquina de tatuaje de lápiz labial, un kit de tatuaje para principiantes, con todo lo que necesita, bolígrafo para máquina de tatuaje, fuente de alimentación para tatuaje, kit de tinta para tatuaje, práctica de tatuaje en la piel, cartuchos de tatuaje y cintas adhesivas para tatuajes., Esta máquina tiene un potente motor japonés, que no se calienta durante mucho tiempo. Es simple, clásica y la máquina más adecuada para líneas precisas y sombras grises. Brinda una mejor experiencia y menos trauma. Longitud: 12 cm. Peso: 154g., Esta máquina cuenta con un sistema de engranajes avanzado que garantiza un funcionamiento silencioso y confiable y un voltaje de funcionamiento de 9 V a 11 V. Modelado de lápiz labial, la máquina de tatuaje Stigma Lipstick es compatible con todo tipo de agujas de cartucho","9,1","56,99 €",STIGMA,36,"1,10"
"Biomaser Juego de máquina de inalámbrica, 2 pcs 1500 mAh batería, bolígrafo rotativo con 20 agujas, 10 botellas de tinta para principiantes y artistas","https://images.mejoresresenas.es/image/fetch/c_scale,f_auto/https%3A%2F%2Fm.media-amazon.com%2Fimages%2FI%2F51Ukdf%2BcdmL._SL500_.jpg","[Versatilidad y accesorios] La máquina es compatible con una amplia gama de cartuchos y agujas, lo que le da la flexibilidad de elegir el tipo de aguja que mejor se adapte a sus necesidades artísticas. El set también incluye 20 cartuchos de aguja y tintas, para que puedas empezar a trabajar de inmediato sin tener que comprar accesorios adicionales., [Tecnología inalámbrica] La función inalámbrica de esta máquina la hace extremadamente práctica y versátil. Sin cables ni conexiones, pueden moverse libremente por el cliente sin estar limitados por la longitud de los cables. Esto garantiza una mayor libertad de movimiento y una experiencia más cómoda tanto para el cliente como para el cliente., [Rendimiento y confiabilidad] El bolígrafo inalámbrico Biomaser ofrece un alto rendimiento y una estabilidad impecable durante su uso. El avanzado motor rotativo garantiza una velocidad constante y consistente, mientras que el sistema de accionamiento alimentado por batería garantiza un rendimiento constante durante toda su vida útil. Esto garantiza una calidad superior y resultados impecables., El Biomaser Wireless Pen es una máquina innovadora y portátil diseñada para proporcionar la máxima precisión y comodidad durante el proceso. El diseño ligero y compacto permite un agarre cómodo y un manejo óptimo, lo que permite realizar trabajos detallados con facilidad., Capacidad de batería inalámbrica con 1500 mAh, alimentada con dos baterías, que funcionan de 5 a 12 voltios. Este dispositivo permite a los artistas grabar de manera eficiente durante 4-6 horas, dependiendo del voltaje de funcionamiento utilizado.","8,3","65,99 €",BIOMASER,40,"1,10"
"Gigabyte NVIDIA GeForce RTX 3060 GAMING OC V2 Targeta gráfica - 12GB GDDR6, 192-bit, PCI-E 4.0, 1837MHz Core Clock, RGB, 2x DP 1.4, 2 x HDMI 2.1, NVIDIA Ampere - GV-N3060GAMING OC-8GD","https://images.mejoresresenas.es/image/fetch/c_scale,f_auto/https%3A%2F%2Fm.media-amazon.com%2Fimages%2FI%2F51OvUow187S._SL500_.jpg","Tamaño de tarjeta L=282 W=117 H=41 mm, Núcleos tensores de tercera generación Obtenga hasta el doble de rendimiento con dispersión estructural y algoritmos de IA avanzados, como DLSS. Estos núcleos proporcionan un enorme aumento en el rendimiento del juego y nuevas habilidades de IA, Núcleos RT de segunda generación Experimente el doble de rendimiento que el núcleo RT de primera generación, así como RT y sombreado simultáneos para un nivel completamente nuevo de seguimiento de la radiación, Multiprocesadores NVIDIA Ampere Streaming Los componentes básicos de las GPU más rápidas y eficientes del mundo, el nuevo Ampere SM ofrece el doble de rendimiento FP32 y una eficiencia energética mejorada., Enfriador Windforce 3X, Carrera del núcleo 1837 MHz","9,8","340,93 €",GIGABYTE TECHNOLOGY,41,1
"Gigabyte NVIDIA GeForce RTX 4060 WINDFORCE OC Targeta gráfica - 8GB GDDR6, 128-bit, PCI-E 4.0, 2475MHz Core Clock, 2x DP 1.4, 2x HDMI 2.1a, NVIDIA DLSS 3 - GV-N4060WF2OC-8GD","https://images.mejoresresenas.es/image/fetch/c_scale,f_auto/https%3A%2F%2Fm.media-amazon.com%2Fimages%2FI%2F51t%2BYiti-YL._SL500_.jpg","Pieza de recambio, Modelo y marca: GIGABYTE RTX 4060 WF2OC, Componente informático","9,7","327,94 €",GIGABYTE TECHNOLOGY,42,1
"MSI V809-2000R NVIDIA GeForce GT 710 2GB - Tarjeta gráfica (Pasivo, LP/ATX, GDDR3, PCI Express x8 2.0)","https://images.mejoresresenas.es/image/fetch/c_scale,f_auto/https%3A%2F%2Fm.media-amazon.com%2Fimages%2FI%2F41fJkzFGAhL._SL500_.jpg","Unidad de procesamiento gráfico NVIDIA GeForce GT 710 con frecuencia de 954 MHz, Resolución digital máxima de 4096 x 2160 píxeles y resolución VGA máxima de 2048 x 1536 píxeles, Interfaz PCI Express x8 2.0 y soporte de control inalámbrico por dispositivos de mano Android / iOS, Conectividad multimedia mediante Dual Link DVI-D, HDMI y VGA con un consumo energético de 19 W, Capacidad de memoria de 2 GB con interfaz 64 bits, DDR3 y frecuencia de 1.8 Gbps","9,5","52,13 €",MSI,43,1
"maxsun AMD Radeon RX 580 8GB Tarjeta Grafica Gaming 2048SP GDDR5 Tarjeta gráfica de vídeo para computadora GPU para Juegos de PC 256 bits DirectX 12 DVI, HDMI, DisplayPort Descodificación 4K","https://images.mejoresresenas.es/image/fetch/c_scale,f_auto/https%3A%2F%2Fm.media-amazon.com%2Fimages%2FI%2F41dZCDTfbHL._SL500_.jpg","Soporta DirectX 12, Vulkan, Shader Model 5.0, OpenGL 4.6/4.5, 4K Video Decode & Encode, La Radeon RX 580 2048SP es una tarjeta gráfica de AMD. Fabricada en el proceso de 14 nm y basada en el procesador gráfico Polaris 20, en su variante Polaris 20 XL, la GPU es compatible con DirectX 12. Esto garantiza que todos los juegos modernos funcionarán en la AMD Radeon RX 580 2048SP. Esto garantiza que todos los juegos modernos se ejecutarán en AMD Radeon RX 580 2048SP., Integrada con una interfaz de memoria de 256 bits GDDR5 de 8 GB., GPU blanca para la construcción de PC de tema blanco, 3 salidas de vídeo digitales completas, HDMI+DP+DVI para ampliar a varios monitores.","9,4","136,99 €",MAXSUN,44,1
MSI GeForce RTX 3050 LP 6G OC,"https://images.mejoresresenas.es/image/fetch/c_scale,f_auto/https%3A%2F%2Fm.media-amazon.com%2Fimages%2FI%2F41zQmTd9P4L._SL500_.jpg","Ventilador doble: dos ventiladores y un optimo disipador térmico garantizan una experiencia fría y silenciosa, Ventilador a medida: el diseño personalizado del ventilador con un aspa optimizada genera más flujo de aire y optimiza la presión, PCB a medida: la placa de circuito impreso personalizada se ha diseñado con circuitos reforzados y trazados para optimizar el rendimiento y la fiabilidad, MSI Center: el software MSI Center te permite monitorizar, ajustar y optimizar los productos MSI en tiempo real, Afterburner: toma el control total con el software de overclocking de las tarjetas gráficas reconocidos y utilizados en todo el mundo","9,3","217,03 €",MSI,45,1
"MAXSUN NVIDIA GeForce GT 710 Tarjeta Grafica 1gb - Tarjeta gráfica GPU (Pasivo, bajo Perfil, bajo Consumo, VGA, DVI-D, HDMI, HTPC, Sistema de refrigeración pasiva silenciosa sin Ventilador)","https://images.mejoresresenas.es/image/fetch/c_scale,f_auto/https%3A%2F%2Fm.media-amazon.com%2Fimages%2FI%2F51jMpguD4ZL._SL500_.jpg","Soporte: PhysX, NVIDIA CUDA, decodificación PureVideo HD 4K, HDR, MFAA, GeForce 3D Vision, GameWorks, G - Sync-Ready, GameStream-Ready, GeForce ShadowPlay, GPU Boost 2.0, E/S FUll HD: HDMI + VGA + DVI-D soporta múltiples pantallas, Diseño de perfil bajo, compatible con ITX o SFF, puedes hacer un sistema delgado o más pequeño más fácilmente, Compatible con la prueba de efecto DirectX 12 integrada, Chipset: NVIDIA Geforce GT 710, refrigeración pasiva de 0 dB eficiente, gran radiador disipador de calor cubre el área de la GPU y la memoria. Proporciona un entorno de bajo ruido y temperatura para juegos y multimedia.","9,2","47,99 €",MAXSUN,46,1
"Radeon HD 5450 Tarjeta gráfica, 2 GB GDDR3 64 bits, DVI/HDMI/VGA, Perfil bajo, PCI Express x16, Tarjeta de Video para PC, GPU, DirectX 11","https://images.mejoresresenas.es/image/fetch/c_scale,f_auto/https%3A%2F%2Fm.media-amazon.com%2Fimages%2FI%2F41G7OSNFkIL._SL500_.jpg","Fuente de alimentación independiente: Sin fuente de alimentación externa, aprox. 19 W de consumo de corriente completa. Si necesita ayuda durante su instalación o uso de la tarjeta gráfica, póngase en contacto con nosotros para obtener ayuda rápida a través de Amazon.Admite solo hasta dos monitores. Soporte completo DirectX11 para imágenes ricas y realistas y rendimiento de juego/vídeo HD. Tecnología de transmisión ATI para acelerar su PC, Diseño sin ventilador para cancelación de ruido cero La HD 5450 es una tarjeta gráfica económica de tamaño pequeño y un sistema de refrigeración pasivo silencioso sin ventilador. Con disipador de calor de alto rendimiento, es lo suficientemente pequeño como para permitir un funcionamiento sin ventilador y cómodo de usar sin ruido., Diseño de perfil bajo Las tarjetas gráficas de ordenador son pequeñas, ahorra más espacio y es fácil de instalar, plug and play. Están diseñados para instalaciones de tamaño completo y también puede construir un sistema de PC compacto, incluso compatible con carcasas ITX. Esta tarjeta de bajo perfil, de bajo consumo de energía mejora el rendimiento multimedia, amplía el escritorio y acelera las aplicaciones., Compatibilidad con varios monitores Hay 3 monitores de interfaces de pantalla para la tarjeta gráfica, incluyendo DVI, VGA, HDMI, y para mayor flexibilidad de uso (la interfaz VGA es extraíble), viene con un soporte de perfil bajo para que pueda utilizarse en un chasis de factor de forma pequeño o una configuración HTPC. La interfaz de bus de la tarjeta gráfica PCI Express es PCI Express 2.0 x 16., 2 GB de memoria GDDR3 AMD Radeon HD 5450 con frecuencia núcleo de 650 MHz, velocidad de memoria de hasta 1066 MHz, procesadores de 80 flujos perfectos para trabajar, edición de vídeo y fotos, permite una buena eficacia que pueda satisfacer sus necesidades de manera efectiva.","9,1","54,98 €",QTHREE,47,1
"QTHREE Geforce GT 210 1G D3 64-bit Tarjeta Grafica, 1x HDMI, 1x VGA, Low Profile Tarjeta Grafica para Mini pc, PCI Express x16, DirectX 10","https://images.mejoresresenas.es/image/fetch/c_scale,f_auto/https%3A%2F%2Fm.media-amazon.com%2Fimages%2FI%2F418kJXasIcL._SL500_.jpg","Las tarjetas gráficas de computadora son pequeñas y puedes construir fácilmente un sistema de PC compacto para una carcasa delgada o ITX., La tarjeta gráfica tiene dos interfaces de salida, salida VGA y HDMI, y admite hasta 2 monitores. No requiere fuente de alimentación externa, solo consumo de energía de 20W., La Geforce GT 210 tiene un reloj central de 589MHz, efectivamente hasta 1066Mbps., Esta tarjeta gráfica de gama baja es adecuada para trabajar, editar vídeos y fotografías, tiene buena fluidez y puede satisfacer eficazmente sus necesidades diarias., Admite Win 10, 8, 7, Vista, XP (no compatible con el sistema Win 11). Compatible con DirectX 10.",9,"45,99 €",QTHREE,48,1
"ASUS GeForce GT 710 (2 GB DDR3 EVO Tarjeta gráfica de bajo Perfil para HTPC silencioso, 2 GB, DDR3, 954 MHz)","https://images.mejoresresenas.es/image/fetch/c_scale,f_auto/https%3A%2F%2Fm.media-amazon.com%2Fimages%2FI%2F41mFT%2BU0fpL._SL500_.jpg","ASUS GeForce GT 710 (2 GB DDR3 EVO Tarjeta gráfica de bajo Perfil para HTPC silencioso, 2 GB, DDR3, 954 MHz), 0, 0, 0","8,8","51,52 €",ASUS,49,1
"ASUS Dual GeForce RTX 3050 OC Edition 6GB GDDR6 (Resistencia al Polvo IP5X, Soporte de Acero Inoxidable, PCIe 4.0, DLSS 3, HDMI 2.1, DisplayPort 1.4a, DVI-D)","https://images.mejoresresenas.es/image/fetch/c_scale,f_auto/https%3A%2F%2Fm.media-amazon.com%2Fimages%2FI%2F41xktjuWkHL._SL500_.jpg","Núcleos tensoriales de tercera generación: obtenga hasta el doble de rendimiento con escasez estructural y algoritmos de IA avanzados como DLSS. Estos núcleos ofrecen un enorme impulso en el rendimiento del juego y capacidades de IA completamente nuevas., Núcleos RT de 2.ª generación: experimente el doble de rendimiento que los núcleos RT de 1.ª generación, además de RT y sombreado simultáneos para un nivel completamente nuevo de rendimiento de trazado de rayos., Multiprocesadores de transmisión NVIDIA Ampere: el nuevo Ampere SM ofrece el doble de rendimiento del FP32 y una eficiencia energética mejorada., La resistencia al polvo IP5X ofrece protección contra la entrada de partículas para una mayor durabilidad., Edición OC: Boost Clock 1537 MHz (modo OC)/ 1507 MHz (modo predeterminado)","8,7","221,64 €",ASUS,50,1
"Neutrogena Rutina Hydro Boost, pack con Gel de Agua Hidratante Facial (50 ml) y Contorno de Ojos Antifatiga (15 ml), set de regalo para una hidratación intensa 72 horas con Ácido Hialurónico","https://images.mejoresresenas.es/image/fetch/c_scale,f_auto/https%3A%2F%2Fm.media-amazon.com%2Fimages%2FI%2F31UXz%2BS9vYL._SL500_.jpg","Rutina facial: Combina la aplicación del gel hidratante por la mañana y por la noche con la crema de contorno de ojos rodeando el ojo, para minimizar las líneas de expresión, Hidratación intensa: Tanto el hidrogel como el contorno de ojos antifatiga ofrecen hidratación intensa para una piel revitalizada, elástica y suave durante todo el día, Gel de agua: Esta crema hidratante facial con hasta un 20% más de ácido hialurónico, reabastece las reservas de agua de la piel para que luzca sana, resplandeciente e hidratada, Detalles del envío: Neutrogena Hydro Boost Gel de Agua + Contorno de ojos, cuidado facial de textura ligera y no grasa, clínicamente probado, sin perfume, no comedogénico, 50 ml + 15 ml, Crema para el contorno de ojos: Su fórmula de triple acción con ácido hialurónico y trehalosa de origen natural proporciona una mirada despierta sin signos de fatiga","9,9","15,55 €",NEUTROGENA,51,"4,7"
"Neutrogena Rutina Hydro Boost, pack con Crema Gel Hydro Boost (50 ml) y Contorno de Ojos Anti-Fatiga (15 ml) de regalo, set de regalo para una hidratación intensa 24 horas con Ácido Hialurónico","https://images.mejoresresenas.es/image/fetch/c_scale,f_auto/https%3A%2F%2Fm.media-amazon.com%2Fimages%2FI%2F51-dpiTwqwL._SL500_.jpg","Rutina facial: Combina la aplicación del gel hidratante por la mañana y por la noche con la crema de contorno de ojos rodeando el ojo, para minimizar las líneas de expresión, Hidratación intensa: La crema hidratante facial y el contorno de ojos antifatiga ofrecen hidratación intensa para una piel revitalizada, elástica y suave durante todo el día, Detalles del envío: Neutrogena Hydro Boost Crema-Gel + Contorno de ojos de regalo, cuidado facial de textura ligera con ácido hialurónico puro, clínicamente probado, 50 ml + 15 ml, Crema-Gel: Esta crema hidratante con acción nutritiva intensa y de larga duración calma la piel al instante y la mantiene hidratada durante todo el día. Para pieles secas., Contorno de Ojos: Empieza el día con la crema para el contorno de los ojos no comedogénica, con su triple acción que proporciona una mirada despierta sin signos de fatiga","9,7","15,45 €",NEUTROGENA,52,"4,7"
"L'Oréal Crema hidratante para hombre, Antiarrugas y antienvejecimiento, Con ácido hialurónico hidratante para el envejecimiento, Para pieles secas y apagadas, Men Expert Power Age, 50ml","https://images.mejoresresenas.es/image/fetch/c_scale,f_auto/https%3A%2F%2Fm.media-amazon.com%2Fimages%2FI%2F41ln2kv8nvL._SL500_.jpg","Viene en un recipiente conveniente y fácil de llevar, Protege e ilumina la piel, Hidrata eficazmente la piel, Elaborado con extracto de viña francesa, Con 5 acciones contra la edad","9,5","8,49 €",L'ORÉAL PARIS,53,"4,7"
"Garnier, Crema de Día Iluminadora con Vitamina C, Corrige líneas y Potencia la luminosidad en 24H, Fórmula Vegana, 50 ml","https://images.mejoresresenas.es/image/fetch/c_scale,f_auto/https%3A%2F%2Fm.media-amazon.com%2Fimages%2FI%2F4132WuksoBL._SL500_.jpg","Piel firme e hidratada durante 24H desde el primer uso, Después de 14 días la piel se ve más suave y uniforme, Después de 28 días las líneas de expresión se reducen, Fórmula Vegana con Vitamina C que nutre, corrige líneas y potencia la luminosidad del rostro, Crema facial de día con Vitamina C para potenciar la luminosidad y el brillo de la piel, recomendado para pieles apagadas, Contenido: 1x Garnier, Crema de Día Iluminadora con Vitamina C, Corrige líneas y Potencia la luminosidad en 24H, Fórmula Vegana, 50 ml, Aplicar diariamente por las mañanas con movimientos circulares sobre rostro y cuello limpios","9,4","6,93 €",GARNIER,54,"4,7"
"L'Oreal Paris Crema Hidratante Anti Arrugas De Día Colágeno, Fresca, Negro, 50 ml (Paquete de 1)","https://images.mejoresresenas.es/image/fetch/c_scale,f_auto/https%3A%2F%2Fm.media-amazon.com%2Fimages%2FI%2F31SVmVFZy9L._SL500_.jpg","Textura ligera que penetra rápidamente, Revitaliza e ilumina la piel, Contiene colágeno que proporciona hidratación, Con ocho aceites esenciales","9,3","5,43 €",L'ORÉAL PARIS,55,"4,7"
"L'Oreal Paris Revitalift Crema de Día Anti-edad Hidratante con Protección Solar SPF 30, Antiarrugas y Extra Firmeza, 50 ml","https://images.mejoresresenas.es/image/fetch/c_scale,f_auto/https%3A%2F%2Fm.media-amazon.com%2Fimages%2FI%2F31FbqNSZU5L._SL500_.jpg","Resultados: Piel inmediatamente protegida, más tonificada e hidratada, Piel más firme con menos arrugas y un rostro más uniforme en 4 semanas, Fórmula compuesta por un poderoso ingrediente activo antiarrugas (Pro-Retinol Avanzado) para alisar la superficie de la piel y un complejo reafirmante (Fibrelastyl) para reforzar la tonicidad de la piel, Crema hidratante anti-edad para una piel tonificada, protegida e hidratada, Prevención contra la aparición de manchas gracias a la protección contra los rayos UVA/UVB, Contenido: 1x L'Oreal Paris Revitalift Crema de Día Hidratante con Protección Solar SPF 30, 50 ml, Aplicar por la mañana en la cara y el cuello completamente limpios con movimientos circulares ascendentes para una óptima penetración en la piel","9,2","7,93 €",L'ORÉAL,56,"4,7"
Crema Regeneradora Rosa Mosqueta - Instituto Español Tarro 400 ML,"https://images.mejoresresenas.es/image/fetch/c_scale,f_auto/https%3A%2F%2Fm.media-amazon.com%2Fimages%2FI%2F31GC1k6r3QL._SL500_.jpg","Rápida Absorción, Previene las Estrías, Fórmula No Grasa, Enriquecido con Ácido Hialurónico","9,1","3,48 €",INSTITUTO ESPAÑOL,57,"4,7"
"Nobleza - Juguete de Goma para Perros, Pollo Gritando Amarillo, Juguete pequeño de descompresión chirriante para Limpiar los Dientes","https://images.mejoresresenas.es/image/fetch/c_scale,f_auto/https%3A%2F%2Fm.media-amazon.com%2Fimages%2FI%2F41dcJ5UF1EL._SL500_.jpg","Promouvoir les sentiments: les chiens et les personnes peuvent jouer, augmenter les interactions et augmenter les sentiments entre les animaux, Nettoyez les dents: forme mignonne, conception de surface inégale, vous pouvez nettoyer les dents du chien lorsqu'il mord, Excellent matériau: le poulet hurlant est fait de caoutchouc 100% naturel, matériau écologique, doux et confortable, résistant aux morsures et au goût agréable, sûr et hygiénique, cela ressemble à une pinc ée, vous offre un toucher confortable et est durable pour un longue durée, Divers scénarios d'utilisation: le poulet hurlant peut être utilisé pour soulager l'amusement, évacuer et réduire la pression, amuser et persuader les bébés, et est également un bon compagnon pour les chiens, Dispositif sonore: contient un dispositif sonore, pressant le produit, il fera un cri magique, qui peut être utilisé pour attirer l'attention du chien.Lorsque le chien démonte les meubles et aboie, il détourne ses yeux et le laisse apprendre à faire Un bon bébé","9,9","11,59 €",NOBLEZA,58,14
"Trixie 3539 Pollo, látex, 47 cm","https://images.mejoresresenas.es/image/fetch/c_scale,f_auto/https%3A%2F%2Fm.media-amazon.com%2Fimages%2FI%2F315yYS94YNL._SL500_.jpg","Látex, Con voz","9,8","10,99 €",TRIXIE,59,14
Nobby 79465 Pollo de látex,"https://images.mejoresresenas.es/image/fetch/c_scale,f_auto/https%3A%2F%2Fm.media-amazon.com%2Fimages%2FI%2F21QT1mRGefL._SL500_.jpg","Pollo, Juguete de látex, Grande: 47 cm, Con un chirriador","9,6","3,01 €",NOBBY,60,14
"Kerbl Pollo de látex, 39 cm","https://images.mejoresresenas.es/image/fetch/c_scale,f_auto/https%3A%2F%2Fm.media-amazon.com%2Fimages%2FI%2F219Q8H5kPqL._SL500_.jpg","Pollo de látex, Longitud: 39 cm., Con chirriador.","9,5","9,74 €",KERBL PET,61,14
